Searched CAT,MDR Report Key,Brand Name,Manufacturer,Lot Number,Problem Codes,Health Effect Codes,Date of Event,Type of Event,Description
HAR1136,13995095,"HARMONIC 1100 SHEARS, 36CM","ETHICON ENDO-SURGERY, LLC.",,,,20220210,Malfunction,"(B)(4). BATCH #: V7015L. ADDITIONAL INFORMATION WAS REQUESTED AND THE FOLLOWING WAS OBTAINED: AN UNKNOWN ERROR OCCURRED. ""REPLACE INSTRUMENT¿ WAS DISPLAYED AFTER THE DEVICE WAS USED FOR 1 HOUR. THE CORD WAS RECONNECTED, AND THE DEVICE WAS RESTARTED, BUT THE ISSUE DID NOT."" INVESTIGATION SUMMARY: THE PRODUCT WAS RETURNED TO ETHICON ENDO SURGERY FOR EVALUATION. VISUAL INSPECTION AND FUNCTIONAL TESTING WERE CONDUCTED ON THE RETURNED DEVICE. THE DEVICE WAS RETURNED WITH THE DISTAL TIP OF THE BLADE BROKEN OFF AND NOT RETURNED. THE REMAINING BLADE PORTION WAS SCRATCHED, AND WITH EVIDENCE OF CONTACT WITH METAL IN OR OUT OF THE OPERATIVE FIELD. THIS BLADE TIP PORTION MAY HAVE BROKEN OFF OF THE DEVICE DURING TRANSPORT TO OUR ANALYSIS SITE. DURING FUNCTIONAL TESTING ON GEN11, AN ALERT SCREEN WAS DISPLAYED. A PROBABLE CAUSE OF THE DEVICE STOP ACTIVATING AND DISPLAY AN ALERT SCREEN IS BLADE DAMAGE. THE DEVICE WAS DISASSEMBLED TO INSPECT THE INTERNAL COMPONENTS AND NO ANOMALIES WERE FOUND. PROBABLE CAUSES OF BLADE DAMAGE, INCLUDING BREAKAGE, ARE EXTERNAL CONTACT DURING PRE-OP OR GENERAL USE, BLADE CONTACT WITH OTHER DEVICES, STAPLES OR CLIPS DURING THE PROCEDURE. ONCE MINOR BLADE DAMAGE HAS OCCURRED, SUBSEQUENT ACTIVATIONS MAY INCREASE THE SEVERITY OF THE BLADE DAMAGE. THIS IN TURN CAN RESULT IN ACTIVATION ISSUES SUCH AS FAILING THE PRE-RUN TEST WITH THE GENERATOR AND DISPLAYING AN ALERT SCREEN. THESE ALERT SCREENS THAT CAN RESULT ARE SUCH AS ""REMOVE INSTRUMENT FROM PATIENT"" OR ¿BLADE ERROR DETECTED¿ OR ""RELAXED PRESSURE ON BLADE"" FOLLOWED BY A ¿REPLACE INSTRUMENT¿ SCREEN LATER IN THE PROCEDURE. CONTINUED USAGE OF THE DAMAGE BLADE CAN RESULT IN A BROKEN BLADE. AS PART OF ETHICON ENDO SURGERY QUALITY PROCESS ALL DEVICES ARE MANUFACTURED, INSPECTED, AND RELEASED TO APPROVED SPECIFICATIONS. A MANUFACTURING RECORD EVALUATION WAS PERFORMED FOR THE FINISHED DEVICE BATCH NUMBER, AND NO NON-CONFORMANCES WERE IDENTIFIED. IF INFORMATION IS OBTAINED THAT WAS NOT AVAILABLE FOR THE INITIAL REPORT, A FOLLOW-UP REPORT WILL BE FILED AS APPROPRIATE. IT WAS REPORTED THAT, DURING A LAPAROSCOPIC UNKNOWN PROCEDURE, AN UNKNOWN ERROR OCCURRED. THE BLADE TIP WAS NOT BROKEN OFF AND NO PIECES FELL INTO THE PATIENT. GEN11 WAS USED. ANOTHER DEVICE WAS USED TO COMPLETE THE CASE. THERE WERE NO ADVERSE CONSEQUENCES TO THE PATIENT.  NO FURTHER INFORMATION IS AVAILABLE."
HAR1136,13995434,"HARMONIC 1100 SHEARS, 36CM","ETHICON ENDO-SURGERY, LLC.",,,,20220204,Malfunction,"IT WAS REPORTED THAT, DURING A RIGHT HEMICOLECTOMY, AN UNKNOWN ERROR OCCURRED DURING USE. THE DEVICE TOUCHED TO THE FORCEPS FOR TWICE, AND KEENING NOISE WAS HEARD. THE BLADE TIP WAS NOT BROKEN OFF AND NO PIECES FELL INTO THE PATIENT. ANOTHER DEVICE WAS USED TO COMPLETE THE CASE. THERE WERE NO ADVERSE CONSEQUENCES TO THE PATIENT. NO FURTHER INFORMATION IS AVAILABLE. BATCH #: V7016C. INVESTIGATION SUMMARY: THE PRODUCT WAS RETURNED TO ETHICON ENDO SURGERY FOR EVALUATION. VISUAL INSPECTION AND FUNCTIONAL TESTING WERE CONDUCTED ON THE RETURNED DEVICE. THE DEVICE WAS RETURNED WITH THE DISTAL TIP OF THE BLADE BROKEN OFF AND RETURNED. THE REMAINING BLADE PORTION WAS SCRATCHED, AND WITH EVIDENCE OF CONTACT WITH METAL IN OR OUT OF THE OPERATIVE FIELD. THIS BLADE TIP PORTION MAY HAVE BROKEN OFF OF THE DEVICE DURING TRANSPORT TO OUR ANALYSIS SITE. DURING FUNCTIONAL TESTING ON GEN11, AN ALERT SCREEN WAS DISPLAYED. A PROBABLE CAUSE OF THE DEVICE STOP ACTIVATING AND DISPLAY AN ALERT SCREEN IS BLADE DAMAGE. THE DEVICE WAS DISASSEMBLED TO INSPECT THE INTERNAL COMPONENTS AND NO ANOMALIES WERE FOUND. PROBABLE CAUSES OF BLADE DAMAGE, INCLUDING BREAKAGE, ARE EXTERNAL CONTACT DURING PRE-OP OR GENERAL USE, BLADE CONTACT WITH OTHER DEVICES, STAPLES OR CLIPS DURING THE PROCEDURE. ONCE MINOR BLADE DAMAGE HAS OCCURRED, SUBSEQUENT ACTIVATIONS MAY INCREASE THE SEVERITY OF THE BLADE DAMAGE. THIS IN TURN CAN RESULT IN ACTIVATION ISSUES SUCH AS FAILING THE PRE-RUN TEST WITH THE GENERATOR AND DISPLAYING AN ALERT SCREEN. THESE ALERT SCREENS THAT CAN RESULT ARE SUCH AS ""REMOVE INSTRUMENT FROM PATIENT"" OR ¿BLADE ERROR DETECTED¿ OR ""RELAXED PRESSURE ON BLADE"" FOLLOWED BY A ¿REPLACE INSTRUMENT¿ SCREEN LATER IN THE PROCEDURE. CONTINUED USAGE OF THE DAMAGE BLADE CAN RESULT IN A BROKEN BLADE. AS PART OF ETHICON ENDO SURGERY QUALITY PROCESS ALL DEVICES ARE MANUFACTURED, INSPECTED, AND RELEASED TO APPROVED SPECIFICATIONS. A MANUFACTURING RECORD EVALUATION WAS PERFORMED FOR THE FINISHED DEVICE BATCH NUMBER, AND NO NON-CONFORMANCES WERE IDENTIFIED. IF INFORMATION IS OBTAINED THAT WAS NOT AVAILABLE FOR THE INITIAL REPORT, A FOLLOW-UP REPORT WILL BE FILED AS APPROPRIATE."
HAR1136,13995511,"HARMONIC 1100 SHEARS, 36CM","ETHICON ENDO-SURGERY, LLC.",V7014U,,,20220127,Malfunction,"IT WAS REPORTED THAT, DURING AN UNKNOWN PROCEDURE, AN UNEXPECTED SOUND WAS HEARD DURING THE ACTIVATION. THERE WAS A SCRATCH ON THE BLADE. THE DEVICE DID NOT CLAMP THE CLIPS. NO PIECES FELL INTO THE PATIENT. GEN11 WAS USED. ANOTHER DEVICE WAS USED TO COMPLETE THE CASE. THERE WERE NO ADVERSE CONSEQUENCES TO THE PATIENT. NO FURTHER INFORMATION IS AVAILABLE. (B)(4). BATCH #: V7014U. ADDITIONAL INFORMATION WAS REQUESTED AND THE FOLLOWING WAS OBTAINED: DID THE ACTIVE TITANIUM BLADE BREAK OFF? THERE WAS A SCRATCH ON THE BLADE. NO FURTHER INFORMATION WILL BE AVAILABLE. INVESTIGATION SUMMARY: THE PRODUCT WAS RETURNED TO ETHICON ENDO SURGERY FOR EVALUATION. VISUAL INSPECTION AND FUNCTIONAL TESTING WERE CONDUCTED ON THE RETURNED DEVICE. THE DEVICE WAS RETURNED WITH THE DISTAL TIP OF THE BLADE BROKEN OFF AND NOT RETURNED. THE REMAINING BLADE PORTION WAS SCRATCHED, AND WITH EVIDENCE OF CONTACT WITH METAL IN OR OUT OF THE OPERATIVE FIELD. THIS BLADE TIP PORTION MAY HAVE BROKEN OFF OF THE DEVICE DURING TRANSPORT TO OUR ANALYSIS SITE. DURING FUNCTIONAL TESTING ON GEN11, AN ALERT SCREEN WAS DISPLAYED. A PROBABLE CAUSE OF THE DEVICE STOP ACTIVATING AND DISPLAY AN ALERT SCREEN IS BLADE DAMAGE. THE DEVICE WAS DISASSEMBLED TO INSPECT THE INTERNAL COMPONENTS AND NO ANOMALIES WERE FOUND. PROBABLE CAUSES OF BLADE DAMAGE, INCLUDING BREAKAGE, ARE EXTERNAL CONTACT DURING PRE-OP OR GENERAL USE, BLADE CONTACT WITH OTHER DEVICES, STAPLES OR CLIPS DURING THE PROCEDURE. ONCE MINOR BLADE DAMAGE HAS OCCURRED, SUBSEQUENT ACTIVATIONS MAY INCREASE THE SEVERITY OF THE BLADE DAMAGE. THIS IN TURN CAN RESULT IN ACTIVATION ISSUES SUCH AS FAILING THE PRE-RUN TEST WITH THE GENERATOR AND DISPLAYING AN ALERT SCREEN. THESE ALERT SCREENS THAT CAN RESULT ARE SUCH AS ""REMOVE INSTRUMENT FROM PATIENT"" OR ¿BLADE ERROR DETECTED¿ OR ""RELAXED PRESSURE ON BLADE"" FOLLOWED BY A ¿REPLACE INSTRUMENT¿ SCREEN LATER IN THE PROCEDURE. CONTINUED USAGE OF THE DAMAGE BLADE CAN RESULT IN A BROKEN BLADE. AS PART OF ETHICON ENDO SURGERY QUALITY PROCESS ALL DEVICES ARE MANUFACTURED, INSPECTED, AND RELEASED TO APPROVED SPECIFICATIONS. A MANUFACTURING RECORD EVALUATION WAS PERFORMED FOR THE FINISHED DEVICE BATCH NUMBER, AND NO NON-CONFORMANCES WERE IDENTIFIED. IF INFORMATION IS OBTAINED THAT WAS NOT AVAILABLE FOR THE INITIAL REPORT, A FOLLOW-UP REPORT WILL BE FILED AS APPROPRIATE."
HAR1136,14014183,"HARMONIC 1100 SHEARS, 36CM","ETHICON ENDO-SURGERY, LLC.",,,,20220201,Malfunction,"(B)(4). BATCH #: V70099. INVESTIGATION SUMMARY: THE PRODUCT WAS RETURNED TO ETHICON ENDO SURGERY FOR EVALUATION. VISUAL INSPECTION AND FUNCTIONAL TESTING WERE CONDUCTED ON THE RETURNED DEVICE. THE DEVICE WAS RETURNED WITH THE DISTAL TIP OF THE BLADE BROKEN OFF AND NOT RETURNED. THE REMAINING BLADE PORTION WAS SCRATCHED, AND WITH EVIDENCE OF CONTACT WITH METAL IN OR OUT OF THE OPERATIVE FIELD. THIS BLADE TIP PORTION MAY HAVE BROKEN OFF OF THE DEVICE DURING TRANSPORT TO OUR ANALYSIS SITE. DURING FUNCTIONAL TESTING ON GEN11, AN ALERT SCREEN WAS DISPLAYED. A PROBABLE CAUSE OF THE DEVICE STOP ACTIVATING AND DISPLAY AN ALERT SCREEN IS BLADE DAMAGE. THE DEVICE WAS DISASSEMBLED TO INSPECT THE INTERNAL COMPONENTS AND NO ANOMALIES WERE FOUND. PROBABLE CAUSES OF BLADE DAMAGE, INCLUDING BREAKAGE, ARE EXTERNAL CONTACT DURING PRE-OP OR GENERAL USE, BLADE CONTACT WITH OTHER DEVICES, STAPLES OR CLIPS DURING THE PROCEDURE. ONCE MINOR BLADE DAMAGE HAS OCCURRED, SUBSEQUENT ACTIVATIONS MAY INCREASE THE SEVERITY OF THE BLADE DAMAGE. THIS IN TURN CAN RESULT IN ACTIVATION ISSUES SUCH AS FAILING THE PRE-RUN TEST WITH THE GENERATOR AND DISPLAYING AN ALERT SCREEN. THESE ALERT SCREENS THAT CAN RESULT ARE SUCH AS ""REMOVE INSTRUMENT FROM PATIENT"" OR ¿BLADE ERROR DETECTED¿ OR ""RELAXED PRESSURE ON BLADE"" FOLLOWED BY A ¿REPLACE INSTRUMENT¿ SCREEN LATER IN THE PROCEDURE. CONTINUED USAGE OF THE DAMAGE BLADE CAN RESULT IN A BROKEN BLADE. AS PART OF ETHICON ENDO SURGERY QUALITY PROCESS ALL DEVICES ARE MANUFACTURED, INSPECTED, AND RELEASED TO APPROVED SPECIFICATIONS. A MANUFACTURING RECORD EVALUATION WAS PERFORMED FOR THE FINISHED DEVICE BATCH NUMBER, AND NO NON-CONFORMANCE'S WERE IDENTIFIED. IF INFORMATION IS OBTAINED THAT WAS NOT AVAILABLE FOR THE INITIAL REPORT, A FOLLOW-UP REPORT WILL BE FILED AS APPROPRIATE. IT WAS REPORTED THAT DURING A LAPAROSCOPIC DRAINAGE AND REMOVAL OF A LEFT OVARIAN CYST THE DEVICE WORKED BRIEFLY THEN YIELDED THE ERROR 'REMOVE FROM PATIENT.' IT WAS CLEANED AND RESET AND STILL YIELDED THE ERROR. A NEW DEVICE WAS USED TO COMPLETE THE CASE WITH NO PATIENT CONSEQUENCES."
HAR1136,14052148,"HARMONIC 1100 SHEARS, 36CM","ETHICON ENDO-SURGERY, LLC.",,,,20220223,Malfunction,"(B)(4). BATCH #: V7009N. INVESTIGATION SUMMARY: THE PRODUCT WAS RETURNED TO ETHICON ENDO SURGERY FOR EVALUATION. VISUAL INSPECTION AND FUNCTIONAL TESTING WERE CONDUCTED ON THE RETURNED DEVICE. THE DEVICE WAS RETURNED WITH THE DISTAL TIP OF THE BLADE BROKEN OFF AND NOT RETURNED. THE REMAINING BLADE PORTION WAS SCRATCHED, AND WITH EVIDENCE OF CONTACT WITH METAL IN OR OUT OF THE OPERATIVE FIELD. THIS BLADE TIP PORTION MAY HAVE BROKEN OFF OF THE DEVICE DURING TRANSPORT TO OUR ANALYSIS SITE. DURING FUNCTIONAL TESTING ON GEN11, AN ALERT SCREEN WAS DISPLAYED. A PROBABLE CAUSE OF THE DEVICE STOP ACTIVATING AND DISPLAY AN ALERT SCREEN IS BLADE DAMAGE. THE DEVICE WAS ANALYZED, AND IT WAS DETERMINED THAT IT WAS USED IN MORE THAN ONE GENERATOR. THE DEVICE IS INTENDED TO BE USED WITH A SINGLE GENERATOR. IF THE DEVICE IS CONNECTED TO A DIFFERENT GENERATOR AN ALERT SCREEN WILL BE DISPLAYED INDICATING TO REPLACE THE INSTRUMENT / NO INSTRUMENT USES REMAINING / RESTART GENERATOR. THE DEVICE WAS DISASSEMBLED TO INSPECT THE INTERNAL COMPONENTS AND NO ANOMALIES WERE FOUND. PROBABLE CAUSES OF BLADE DAMAGE, INCLUDING BREAKAGE, ARE EXTERNAL CONTACT DURING PRE-OP OR GENERAL USE, BLADE CONTACT WITH OTHER DEVICES, STAPLES OR CLIPS DURING THE PROCEDURE. ONCE MINOR BLADE DAMAGE HAS OCCURRED, SUBSEQUENT ACTIVATIONS MAY INCREASE THE SEVERITY OF THE BLADE DAMAGE. THIS IN TURN CAN RESULT IN ACTIVATION ISSUES SUCH AS FAILING THE PRE-RUN TEST WITH THE GENERATOR AND DISPLAYING AN ALERT SCREEN. THESE ALERT SCREENS THAT CAN RESULT ARE SUCH AS ""REMOVE INSTRUMENT FROM PATIENT"" OR ¿BLADE ERROR DETECTED¿ OR ""RELAXED PRESSURE ON BLADE"" FOLLOWED BY A ¿REPLACE INSTRUMENT¿ SCREEN LATER IN THE PROCEDURE. CONTINUED USAGE OF THE DAMAGE BLADE CAN RESULT IN A BROKEN BLADE. THIS DEVICE IS PACKAGED AND STERILIZED FOR SINGLE USE ONLY. MULTIPLE PATIENT USE MAY COMPROMISE THE DEVICE INTEGRITY OR CREATE A RISK OF CONTAMINATION THAT, IN TURN, MAY RESULT IN PATIENT INJURY OR ILLNESS. AS PART OF ETHICON ENDO SURGERY QUALITY PROCESS ALL DEVICES ARE MANUFACTURED, INSPECTED, AND RELEASED TO APPROVED SPECIFICATIONS. A MANUFACTURING RECORD EVALUATION WAS PERFORMED FOR THE FINISHED DEVICE BATCH NUMBER, AND NO NON-CONFORMANCES WERE IDENTIFIED. IT WAS REPORTED THAT DURING A LAP GASTRIC BYPASS HARMONIC THE DEVICE STOPPED WORKING. THE ERROR OCCURRED AS THE DEVICE WAS ACTIVATED ON MESENTERY. THE PROCEDURE WAS COMPLETED SUCCESSFULLY. THERE WAS NO PATIENT CONSEQUENCES."
HAR1136,14073647,"HARMONIC 1100 SHEARS, 36CM","ETHICON ENDO-SURGERY, LLC.",,,,20220317,Malfunction,"(B)(4). BATCH #: UNKNOWN. AN ANALYSIS OF THE PRODUCT COULD NOT BE PERFORMED SINCE A PHYSICAL SAMPLE WAS NOT RECEIVED FOR EVALUATION. AN EVALUATION OF THE MANUFACTURING RECORD COULD NOT BE PERFORMED AS THE REQUIRED PRODUCT IDENTIFICATION NUMBER WAS NOT PROVIDED TO COMPLETE THE EVALUATION. AS PART OF OUR COMPANY QUALITY SYSTEM PROCESS, ALL DEVICES ARE MANUFACTURED, INSPECTED, AND DISTRIBUTED TO APPROVED SPECIFICATIONS. IF INFORMATION IS OBTAINED THAT WAS NOT AVAILABLE FOR THE INITIAL REPORT, A FOLLOW-UP REPORT WILL BE FILED AS APPROPRIATE. IT WAS REPORTED THAT, DURING A LAPAROSCOPIC HEPATECTOMY, THE BLADE BROKE. THERE IS A POSSIBILITY THAT THE DEVICE TOUCHED THE SUCTIONING DEVICE. THE DEVICE WAS REPLACED, BUT AN UNKNOWN ERROR OCCURRED DURING USE. NO PIECES FELL INTO THE PATIENT. SONOSURG DEVICE WAS USED TO COMPLETE THE CASE. THERE WERE NO ADVERSE CONSEQUENCES TO THE PATIENT. NO FURTHER INFORMATION IS AVAILABLE."
HAR1136,14074010,"HARMONIC 1100 SHEARS, 36CM","ETHICON ENDO-SURGERY, LLC.",,,,20220318,Malfunction,"(B)(4). BATCH #: V7022D. ATTEMPTS HAVE BEEN MADE TO RETRIEVE THE DEVICE. TO DATE THE DEVICE HAS NOT BEEN RETURNED. IF THE DEVICE OR FURTHER DETAILS ARE RECEIVED AT A LATER DATE A SUPPLEMENTAL MEDWATCH WILL BE SENT. THIS IS AN ANALYSIS FOR AN IMAGE SUBMITTED TO ETHICON ENDO SURGERY FOR EVALUATION. IMAGE (IMG_7334): THE IMAGE PROVIDED BY THE CUSTOMER SHOWS AN HAR1136 INSTRUMENT. NO DAMAGE COULD BE OBSERVED. NO CONCLUSION COULD BE REACHED AS TO HOW THIS ISSUE OCCURRED THROUGH PHOTO ANALYSIS. A MANUFACTURING RECORD EVALUATION WAS PERFORMED FOR THE FINISHED DEVICE BATCH NUMBER, AND NO NON-CONFORMANCE'S WERE IDENTIFIED. AS PART OF ETHICON ENDO SURGERY QUALITY PROCESS ALL DEVICES ARE MANUFACTURED, INSPECTED, AND RELEASED TO APPROVED SPECIFICATIONS. BECAUSE THE INSTRUMENT WAS NOT RETURNED OUR EVALUATION IS LIMITED. WE VALUE THE OPPORTUNITY TO FULLY ANALYZE THE INSTRUMENT UPON ITS RETURN. IT WAS REPORTED THAT, DURING A LAPAROSCOPIC ANTERIOR RESECTION, ¿REPLACE INSTRUMENT/BLADE ERROR DETECTED¿ WAS DISPLAYED. THE BLADE BROKE. NO PIECES FELL INTO THE PATIENT. GEN11 WAS USED. ANOTHER DEVICE WAS USED TO COMPLETE THE CASE. THERE WERE NO ADVERSE CONSEQUENCES TO THE PATIENT. NO FURTHER INFORMATION IS AVAILABLE. (B)(4). DATE SENT: 5/13/2022. D4 BATCH #: V7022D. INVESTIGATION SUMMARY: THE PRODUCT WAS RETURNED TO ETHICON ENDO SURGERY FOR EVALUATION. VISUAL INSPECTION AND FUNCTIONAL TESTING WERE CONDUCTED ON THE RETURNED DEVICE. THE DEVICE WAS RETURNED WITH THE BLADE SCRATCHED AND CRACKED. THE BLADE TIP WAS NOT BROKEN OFF AS REPORTED BY THE CUSTOMER. DURING FUNCTIONAL TESTING ON GEN11, AN ALERT SCREEN WAS DISPLAYED. THE DEVICE WAS DISASSEMBLED TO INSPECT THE INTERNAL COMPONENTS AND NO ANOMALIES WERE FOUND. PROBABLE CAUSES OF BLADE DAMAGE, INCLUDING BREAKAGE, ARE EXTERNAL CONTACT DURING PRE-OP OR GENERAL USE, BLADE CONTACT WITH OTHER DEVICES, STAPLES OR CLIPS DURING THE PROCEDURE. ONCE MINOR BLADE DAMAGE HAS OCCURRED, SUBSEQUENT ACTIVATIONS MAY INCREASE THE SEVERITY OF THE BLADE DAMAGE. THIS IN TURN CAN RESULT IN ACTIVATION ISSUES SUCH AS FAILING THE PRE-RUN TEST WITH THE GENERATOR AND DISPLAYING AN ALERT SCREEN. THESE ALERT SCREENS THAT CAN RESULT ARE SUCH AS ""REMOVE INSTRUMENT FROM PATIENT"" OR ¿BLADE ERROR DETECTED¿ OR ""RELAXED PRESSURE ON BLADE"" FOLLOWED BY A ¿REPLACE INSTRUMENT¿ SCREEN LATER IN THE PROCEDURE. CONTINUED USAGE OF THE DAMAGE BLADE CAN RESULT IN A BROKEN BLADE. AS PART OF ETHICON ENDO SURGERY QUALITY PROCESS ALL DEVICES ARE MANUFACTURED, INSPECTED, AND RELEASED TO APPROVED SPECIFICATIONS. A MANUFACTURING RECORD EVALUATION WAS PERFORMED FOR THE FINISHED DEVICE BATCH NUMBER, AND NO NON-CONFORMANCES WERE IDENTIFIED."
HAR1136,14079746,"HARMONIC 1100 SHEARS, 36CM","ETHICON ENDO-SURGERY, LLC.",,,,20220114,Malfunction,"PC-(B)(4). DATE SENT: (B)(6) 2022. BATCH #: V7012C. INVESTIGATION SUMMARY THE PRODUCT WAS RETURNED TO ETHICON ENDO SURGERY FOR EVALUATION. VISUAL INSPECTION AND FUNCTIONAL TESTING WERE CONDUCTED ON THE RETURNED DEVICE. THE DEVICE WAS RETURNED WITH THE DISTAL TIP OF THE BLADE BROKEN OFF AND NOT RETURNED. THE REMAINING BLADE PORTION WAS SCRATCHED, AND WITH EVIDENCE OF CONTACT WITH METAL IN OR OUT OF THE OPERATIVE FIELD. THIS BLADE TIP PORTION MAY HAVE BROKEN OFF OF THE DEVICE DURING TRANSPORT TO OUR ANALYSIS SITE. DURING FUNCTIONAL TESTING ON GEN11, AN ALERT SCREEN WAS DISPLAYED. A PROBABLE CAUSE OF THE DEVICE STOP ACTIVATING AND DISPLAY AN ALERT SCREEN IS BLADE DAMAGE. THE DEVICE WAS DISASSEMBLED TO INSPECT THE INTERNAL COMPONENTS AND NO ANOMALIES WERE FOUND. PROBABLE CAUSES OF BLADE DAMAGE, INCLUDING BREAKAGE, ARE EXTERNAL CONTACT DURING PRE-OP OR GENERAL USE, BLADE CONTACT WITH OTHER DEVICES, STAPLES OR CLIPS DURING THE PROCEDURE. ONCE MINOR BLADE DAMAGE HAS OCCURRED, SUBSEQUENT ACTIVATIONS MAY INCREASE THE SEVERITY OF THE BLADE DAMAGE. THIS IN TURN CAN RESULT IN ACTIVATION ISSUES SUCH AS FAILING THE PRE-RUN TEST WITH THE GENERATOR AND DISPLAYING AN ALERT SCREEN. THESE ALERT SCREENS THAT CAN RESULT ARE SUCH AS ""REMOVE INSTRUMENT FROM PATIENT"" OR ¿BLADE ERROR DETECTED¿ OR ""RELAXED PRESSURE ON BLADE"" FOLLOWED BY A ¿REPLACE INSTRUMENT¿ SCREEN LATER IN THE PROCEDURE. CONTINUED USAGE OF THE DAMAGE BLADE CAN RESULT IN A BROKEN BLADE. AS PART OF ETHICON ENDO SURGERY QUALITY PROCESS ALL DEVICES ARE MANUFACTURED, INSPECTED, AND RELEASED TO APPROVED SPECIFICATIONS. A MANUFACTURING RECORD EVALUATION WAS PERFORMED FOR THE FINISHED DEVICE BATCH NUMBER, AND NO NON-CONFORMANCES WERE IDENTIFIED. IT WAS REPORTED THAT DURING A LAP GASTRECTOMY THE SHEARS WORKED AS EXPECTED. AT THE END, THE GENERATOR SHOWED CLEAN INSTRUMENT. AFTER CLEANING AND TEST THE GENERATOR SHOWED  CHANGE INSTRUMENT. FINISHED PROCEDURE WITH A NEW PRODUCT. NO PATIENT HARM REPORTED."
HAR1136,14137367,"HARMONIC 1100 SHEARS, 36CM","ETHICON ENDO-SURGERY, LLC.",,,,20220101,Malfunction,"(B)(4). DATE SENT: 4/18/2022, BATCH #: V7009N. INVESTIGATION SUMMARY THE PRODUCT WAS RETURNED TO ETHICON ENDO SURGERY FOR EVALUATION. VISUAL INSPECTION AND FUNCTIONAL TESTING WERE CONDUCTED ON THE RETURNED DEVICE. THE DEVICE WAS RETURNED WITH THE DISTAL TIP OF THE BLADE BROKEN OFF AND NOT RETURNED. THE REMAINING BLADE PORTION WAS SCRATCHED, AND WITH EVIDENCE OF CONTACT WITH METAL IN OR OUT OF THE OPERATIVE FIELD. THIS BLADE TIP PORTION MAY HAVE BROKEN OFF OF THE DEVICE DURING TRANSPORT TO OUR ANALYSIS SITE. DURING FUNCTIONAL TESTING ON GEN11, AN ALERT SCREEN WAS DISPLAYED. A PROBABLE CAUSE OF THE DEVICE STOP ACTIVATING AND DISPLAY AN ALERT SCREEN IS BLADE DAMAGE. THE DEVICE WAS DISASSEMBLED TO INSPECT THE INTERNAL COMPONENTS AND NO ANOMALIES WERE FOUND. PROBABLE CAUSES OF BLADE DAMAGE, INCLUDING BREAKAGE, ARE EXTERNAL CONTACT DURING PRE-OP OR GENERAL USE, BLADE CONTACT WITH OTHER DEVICES, STAPLES OR CLIPS DURING THE PROCEDURE. ONCE MINOR BLADE DAMAGE HAS OCCURRED, SUBSEQUENT ACTIVATIONS MAY INCREASE THE SEVERITY OF THE BLADE DAMAGE. THIS IN TURN CAN RESULT IN ACTIVATION ISSUES SUCH AS FAILING THE PRE-RUN TEST WITH THE GENERATOR AND DISPLAYING AN ALERT SCREEN. THESE ALERT SCREENS THAT CAN RESULT ARE SUCH AS ""REMOVE INSTRUMENT FROM PATIENT"" OR ¿BLADE ERROR DETECTED¿ OR ""RELAXED PRESSURE ON BLADE"" FOLLOWED BY A ¿REPLACE INSTRUMENT¿ SCREEN LATER IN THE PROCEDURE. CONTINUED USAGE OF THE DAMAGE BLADE CAN RESULT IN A BROKEN BLADE. AS PART OF ETHICON ENDO SURGERY QUALITY PROCESS ALL DEVICES ARE MANUFACTURED, INSPECTED, AND RELEASED TO APPROVED SPECIFICATIONS. A MANUFACTURING RECORD EVALUATION WAS PERFORMED FOR THE FINISHED DEVICE BATCH NUMBER, AND NO NON-CONFORMANCES WERE IDENTIFIED. IT WAS REPORTED THAT DURING LAPAROSCOPIC GASTRO BYPASS, THE DOCTOR RECEIVED THE ERROR MESSAGE ¿REMOVE FROM PATIENT¿ AND THEN DID. ONCE HE WENT BACK TO REACTIVATE, THE GENERATOR ALERTED TO REPLACE INSTRUMENT. THEY WERE ABLE TO COMPLETE THE PROCEDURE BY OPENING A SECOND DEVICE. NO PATIENT CONSEQUENCES."
HAR1136,14138073,"HARMONIC 1100 SHEARS, 36CM","ETHICON ENDO-SURGERY, LLC.",V7022D,,,20220328,Malfunction,"IT WAS REPORTED THAT, DURING A RESPIRATORY SURGERY, AN UNKNOWN ERROR OCCURRED AND BECAME NOT TO FUNCTION WHEN THE DEVICE TOUCHED TO THE METAL. THE BLADE BROKE. NO PIECES FELL INTO THE PATIENT. GEN11 WAS USED. ANOTHER DEVICE WAS USED TO COMPLETE THE CASE. THERE WERE NO ADVERSE CONSEQUENCES TO THE PATIENT. NO FURTHER INFORMATION IS AVAILABLE. (B)(4). BATCH #: UNKNOWN. ATTEMPTS HAVE BEEN MADE TO RETRIEVE THE DEVICE. TO DATE THE DEVICE HAS NOT BEEN RETURNED. IF THE DEVICE OR FURTHER DETAILS ARE RECEIVED AT A LATER DATE A SUPPLEMENTAL MEDWATCH WILL BE SENT. A MANUFACTURING RECORD EVALUATION WAS PERFORMED FOR THE FINISHED DEVICE LOT NUMBER, AND NO NON-CONFORMANCE WERE IDENTIFIED. (B)(4). DATE SENT: 5/13/2022. D4 BATCH #: V7022D. INVESTIGATION SUMMARY: THE PRODUCT WAS RETURNED TO ETHICON ENDO SURGERY FOR EVALUATION. VISUAL INSPECTION AND FUNCTIONAL TESTING WERE CONDUCTED ON THE RETURNED DEVICE. THE DEVICE WAS RETURNED WITH NO APPARENT DAMAGE. THE BLADE TIP WAS NOT BROKEN OFF AS REPORTED BY THE CUSTOMER. THE DEVICE WAS CONNECTED TO A GEN11. THE DEVICE WAS FUNCTIONAL AND WORKED AS INTENDED. THERE WERE NO ANOMALIES NOTED WITH THE FUNCTIONALITY OF THE DEVICE. THERE WERE NO ALERT SCREENS DISPLAYED AT ANY TIME DURING TESTING. THE DEVICE WAS DISASSEMBLED TO INSPECT THE INTERNAL COMPONENTS AND NO ANOMALIES WERE FOUND. THE EVENT DESCRIBED COULD NOT BE CONFIRMED AS THE DEVICE WAS RETURNED WITHOUT DETECTABLE DAMAGE. ALTHOUGH NO PRODUCT DEFECT WAS IDENTIFIED, THERE MAY HAVE BEEN OTHER CIRCUMSTANCES OR ISSUES THAT OCCURRED DURING THE USE OF THE DEVICE THAT COULD NOT BE REPLICATED DURING THE LABORATORY ANALYSIS. AS PART OF ETHICON ENDO SURGERY QUALITY PROCESS ALL DEVICES ARE MANUFACTURED, INSPECTED, AND RELEASED TO APPROVED SPECIFICATIONS. A MANUFACTURING RECORD EVALUATION WAS PERFORMED FOR THE FINISHED DEVICE BATCH NUMBER, AND NO NON-CONFORMANCES WERE IDENTIFIED."
HAR1136,14160160,"HARMONIC 1100 SHEARS, 36CM","ETHICON ENDO-SURGERY, LLC.",,,,20220329,Malfunction,"IT WAS REPORTED THAT, DURING AN UNKNOWN PROCEDURE, THE DEVICE COULD NOT HEMOSTASIS WELL. THE BLADE TIP WAS NOT BROKEN OFF AND NO PIECES FELL INTO THE PATIENT. ANOTHER DEVICE WAS USED TO COMPLETE THE CASE. THERE WERE NO ADVERSE CONSEQUENCES TO THE PATIENT. NO FURTHER INFORMATION IS AVAILABLE. (B)(4). DATE OF EVENT: UNKNOWN; CAPTURED AS AWARENESS DATE. BATCH #: V70178. INVESTIGATION SUMMARY: THE PRODUCT WAS RETURNED TO ETHICON ENDO SURGERY FOR EVALUATION. VISUAL INSPECTION AND FUNCTIONAL TESTING WERE CONDUCTED ON THE RETURNED DEVICE. THE DEVICE WAS RETURNED WITH THE DISTAL TIP OF THE BLADE BROKEN OFF AND NOT RETURNED. THE REMAINING BLADE PORTION WAS SCRATCHED, AND WITH EVIDENCE OF CONTACT WITH METAL IN OR OUT OF THE OPERATIVE FIELD. DURING FUNCTIONAL TESTING ON GEN11, AN ALERT SCREEN WAS DISPLAYED. A PROBABLE CAUSE FOR THE DEVICE TO STOP ACTIVATING AND THE GEN11 TO DISPLAY AN ALERT SCREEN IS BLADE DAMAGE. DUE TO THE DEVICE RETURNED CONDITION WE WERE UNABLE TO INVESTIGATE FURTHER THE REPORTED TISSUE EFFECT TISSUES. THE DEVICE WAS DISASSEMBLED TO INSPECT THE INTERNAL COMPONENTS AND NO ANOMALIES WERE FOUND. PROBABLE CAUSES OF BLADE DAMAGE, INCLUDING BREAKAGE, ARE EXTERNAL CONTACT DURING PRE-OP OR GENERAL USE, BLADE CONTACT WITH OTHER DEVICES, STAPLES OR CLIPS DURING THE PROCEDURE. ONCE MINOR BLADE DAMAGE HAS OCCURRED, SUBSEQUENT ACTIVATIONS MAY INCREASE THE SEVERITY OF THE BLADE DAMAGE. THIS IN TURN CAN RESULT IN ACTIVATION ISSUES SUCH AS FAILING THE PRE-RUN TEST WITH THE GENERATOR AND DISPLAYING AN ALERT SCREEN. THESE ALERT SCREENS THAT CAN RESULT ARE SUCH AS ""REMOVE INSTRUMENT FROM PATIENT"" OR ¿BLADE ERROR DETECTED¿ OR ""RELAXED PRESSURE ON BLADE"" FOLLOWED BY A ¿REPLACE INSTRUMENT¿ SCREEN LATER IN THE PROCEDURE. CONTINUED USAGE OF THE DAMAGE BLADE CAN RESULT IN A BROKEN BLADE. AS PART OF ETHICON ENDO SURGERY QUALITY PROCESS ALL DEVICES ARE MANUFACTURED, INSPECTED, AND RELEASED TO APPROVED SPECIFICATIONS. A MANUFACTURING RECORD EVALUATION WAS PERFORMED FOR THE FINISHED DEVICE BATCH NUMBER, AND NO NON-CONFORMANCES WERE IDENTIFIED. IF INFORMATION IS OBTAINED THAT WAS NOT AVAILABLE FOR THE INITIAL REPORT, A FOLLOW-UP REPORT WILL BE FILED AS APPROPRIATE."
