Searched CAT,MDR Report Key,Brand Name,Manufacturer,Lot Number,Problem Codes,Health Effect Codes,Date of Event,Type of Event,Description
HAR1136,13589088,"HARMONIC 1100 SHEARS, 36CM","ETHICON ENDO-SURGERY, LLC.",,,,20211130,Malfunction,"IT WAS REPORTED THAT DURING A CHOLECYSTECTOMY PROCEDURE, THE GENERATOR STATED TO REPLACE DEVICE. THE DEVICE STOPPED WORKING MID-CASE. THERE WERE NO PATIENT CONSEQUENCES REPORTED. (B)(4). BATCH #: V7006N. ADDITIONAL INFORMATION WAS REQUESTED AND THE FOLLOWING WAS OBTAINED: AN INTERNAL RAPID RESPONSE CALL WAS HELD TO DISCUSS THE REPLACE INSTRUMENT ERRORS. THE REPS INDICATED THAT THE AFFECTED SURGEON IS A BARIATRIC DOCTOR WHO DOES ABOUT 150 PROCEDURES A YEAR, 50 ARE GASTRIC BYPASSES. HE USES THE 1100 FOR BYPASSES. HE ORIGINALLY USED THE HDI BUT MOVED TO THE 1100. THE SURGEON DOES NOT CUT THROUGH STAPLE LINES OR DOING THINGS OUT OF THE ORDINARY. HE HAS BEEN GETTING THE ¿REPLACE INSTRUMENT¿ ERRORS MID-WAY TO EARLIER IN THE PROCEDURE. THE TROUBLE SHOOTING INTRA-OP INCLUDES CLEANING THE DEVICE WHEN PROMPTED BY THE GENERATOR AND WHEN THE DEVICE IS PLACED BACK INTO THE PATIENT, THE SURGEON GETS THE ¿REPLACE INSTRUMENT¿ ERROR. THE TEAM WALKED THROUGH WHAT THESE SCREENS MEAN IN REFERENCE TO THE CONDITION OF THE DEVICE AND BLADE. ALSO WENT THROUGH HOW THE ACE+7 IS DIFFERENT FROM THE 1100. IT WAS COMMUNICATED THAT THE SURGEON SHOULD NOT TOUCH THE UTERINE MANIPULATOR OR ANYTHING HARDER THAN TITANIUM WHEN USING THE 1100, OTHERWISE IT COULD CAUSE DAMAGE TO THE BLADE. THE FOLLOWING INFORMATION WAS REQUESTED, BUT UNAVAILABLE: CAN IT BE CONFIRMED IF THE BLADE TIP WAS PRESENT FOR THE ENTIRE USE OF THE DEFECTIVE DEVICE? WERE ACTIVE BLADE FRAGMENTS GENERATED? IF YES, WERE THEY REMOVED EASILY WITHOUT ADDITIONAL INTERVENTION? INVESTIGATION SUMMARY THE PRODUCT WAS RETURNED TO ETHICON ENDO SURGERY FOR EVALUATION. VISUAL INSPECTION AND FUNCTIONAL TESTING WERE CONDUCTED ON THE RETURNED DEVICE. THE DEVICE WAS RETURNED WITH THE DISTAL TIP OF THE BLADE BROKEN OFF AND NOT RETURNED. THE REMAINING BLADE PORTION WAS SCRATCHED, AND WITH EVIDENCE OF CONTACT WITH METAL IN OR OUT OF THE OPERATIVE FIELD. THIS BLADE TIP PORTION MAY HAVE BROKEN OFF OF THE DEVICE DURING TRANSPORT TO OUR ANALYSIS SITE. DURING FUNCTIONAL TESTING ON GEN11, AN ALERT SCREEN WAS DISPLAYED. A PROBABLE CAUSE OF THE DEVICE STOP ACTIVATING AND DISPLAY AN ALERT SCREEN IS BLADE DAMAGE. THE DEVICE WAS DISASSEMBLED TO INSPECT THE INTERNAL COMPONENTS AND NO ANOMALIES WERE FOUND. PROBABLE CAUSES OF BLADE DAMAGE, INCLUDING BREAKAGE, ARE EXTERNAL CONTACT DURING PRE-OP OR GENERAL USE, BLADE CONTACT WITH OTHER DEVICES, STAPLES OR CLIPS DURING THE PROCEDURE. ONCE MINOR BLADE DAMAGE HAS OCCURRED, SUBSEQUENT ACTIVATIONS MAY INCREASE THE SEVERITY OF THE BLADE DAMAGE. THIS IN TURN CAN RESULT IN ACTIVATION ISSUES SUCH AS FAILING THE PRE-RUN TEST WITH THE GENERATOR AND DISPLAYING AN ALERT SCREEN. THESE ALERT SCREENS THAT CAN RESULT ARE SUCH AS ""REMOVE INSTRUMENT FROM PATIENT"" OR ¿BLADE ERROR DETECTED¿ OR ""RELAXED PRESSURE ON BLADE"" FOLLOWED BY A ¿REPLACE INSTRUMENT¿ SCREEN LATER IN THE PROCEDURE. CONTINUED USAGE OF THE DAMAGE BLADE CAN RESULT IN A BROKEN BLADE. AS PART OF ETHICON ENDO SURGERY QUALITY PROCESS ALL DEVICES ARE MANUFACTURED, INSPECTED, AND RELEASED TO APPROVED SPECIFICATIONS. A MANUFACTURING RECORD EVALUATION WAS PERFORMED FOR THE FINISHED DEVICE BATCH NUMBER, AND NO NON-CONFORMANCES WERE IDENTIFIED. ADDITIONAL COMPLAINT INFORMATION MONITORING FOR POTENTIAL SAFETY SIGNALS WILL BE CONDUCTED THROUGH COMPLAINT TRENDING AS PART OF POST MARKET SURVEILLANCE. IF INFORMATION IS OBTAINED THAT WAS NOT AVAILABLE FOR THE INITIAL REPORT, A FOLLOW-UP REPORT WILL BE FILED AS APPROPRIATE."
HAR1136,13589090,"HARMONIC 1100 SHEARS, 36CM","ETHICON ENDO-SURGERY, LLC.",,,,20220207,Malfunction,"IT WAS REPORTED THAT, DURING AN UNKNOWN PROCEDURE, THE BLADE BROKE DURING USE. NO PIECES FELL INTO THE PATIENT. THERE IS A POSSIBILITY THAT THE DEVICE CLAMPED THE CLIPS. ANOTHER DEVICE WAS USED TO COMPLETE THE CASE. THERE WERE NO ADVERSE CONSEQUENCES TO THE PATIENT. NO FURTHER INFORMATION IS AVAILABLE. (B)(4). DATE OF EVENT: UNKNOWN; CAPTURED AS AWARENESS DATE. BATCH #: UNKNOWN. ATTEMPTS HAVE BEEN MADE TO RETRIEVE THE DEVICE. TO DATE THE DEVICE HAS NOT BEEN RETURNED. IF THE DEVICE OR FURTHER DETAILS ARE RECEIVED AT A LATER DATE A SUPPLEMENTAL MEDWATCH WILL BE SENT. THE LOT/BATCH WAS NOT PROVIDED; THEREFORE, THE MANUFACTURING RECORDS EVALUATION COULD NOT BE PERFORMED. IF INFORMATION IS OBTAINED THAT WAS NOT AVAILABLE FOR THE INITIAL REPORT, A FOLLOW-UP REPORT WILL BE FILED AS APPROPRIATE. (B)(4). DATE SENT: 3/21/2022. INVESTIGATION SUMMARY: THE PRODUCT WAS RETURNED TO ETHICON ENDO SURGERY FOR EVALUATION. VISUAL INSPECTION AND FUNCTIONAL TESTING WERE CONDUCTED ON THE RETURNED DEVICE. THE DEVICE WAS RETURNED WITH THE DISTAL TIP OF THE BLADE BROKEN OFF AND NOT RETURNED. THE REMAINING BLADE PORTION WAS SCRATCHED, AND WITH EVIDENCE OF CONTACT WITH METAL IN OR OUT OF THE OPERATIVE FIELD. DURING FUNCTIONAL TESTING ON GEN11, AN ALERT SCREEN WAS DISPLAYED. A PROBABLE CAUSE FOR THE DEVICE TO STOP ACTIVATING AND THE GEN11 TO DISPLAY AN ALERT SCREEN IS BLADE DAMAGE. THE DEVICE WAS DISASSEMBLED TO INSPECT THE INTERNAL COMPONENTS AND NO ANOMALIES WERE FOUND. PROBABLE CAUSES OF BLADE DAMAGE, INCLUDING BREAKAGE, ARE EXTERNAL CONTACT DURING PRE-OP OR GENERAL USE, BLADE CONTACT WITH OTHER DEVICES, STAPLES OR CLIPS DURING THE PROCEDURE. ONCE MINOR BLADE DAMAGE HAS OCCURRED, SUBSEQUENT ACTIVATIONS MAY INCREASE THE SEVERITY OF THE BLADE DAMAGE. THIS IN TURN CAN RESULT IN ACTIVATION ISSUES SUCH AS FAILING THE PRE-RUN TEST WITH THE GENERATOR AND DISPLAYING AN ALERT SCREEN. THESE ALERT SCREENS THAT CAN RESULT ARE SUCH AS ""REMOVE INSTRUMENT FROM PATIENT"" OR ¿BLADE ERROR DETECTED¿ OR ""RELAXED PRESSURE ON BLADE"" FOLLOWED BY A ¿REPLACE INSTRUMENT¿ SCREEN LATER IN THE PROCEDURE. CONTINUED USAGE OF THE DAMAGE BLADE CAN RESULT IN A BROKEN BLADE. AS PART OF ETHICON ENDO SURGERY QUALITY PROCESS ALL DEVICES ARE MANUFACTURED, INSPECTED, AND RELEASED TO APPROVED SPECIFICATIONS. A MANUFACTURING RECORD EVALUATION WAS PERFORMED FOR THE FINISHED DEVICE BATCH NUMBER, AND NO NON-CONFORMANCES WERE IDENTIFIED."
HAR1136,13601123,"HARMONIC 1100 SHEARS, 36CM","ETHICON ENDO-SURGERY, LLC.",V7012C,,,20220202,Malfunction,"IT WAS REPORTED THAT, DURING A LAPAROSCOPIC UTERINE CANCER SURGERY, BLUE FOREIGN MATTER CAME OFF FROM THE DEVICE TIP IN 1 HOUR OF USE. THE TISSUE PAD FELL OFF THE CLAMP ARM. THE BLADE TIP WAS NOT BROKEN OFF AND NO PIECES FELL INTO THE PATIENT. ANOTHER DEVICE WAS USED TO COMPLETE THE CASE. THERE WERE NO ADVERSE CONSEQUENCES TO THE PATIENT. NO FURTHER INFORMATION IS AVAILABLE. (B)(4). BATCH #: UNKNOWN. ADDITIONAL INFORMATION WAS REQUESTED AND THE FOLLOWING WAS OBTAINED: NO FOREIGN MATTER WAS FOUND. IS THE WHITE TISSUE PAD COMPLETELY MISSING FROM THE CLAMP ARM OF THE DEVICE? THE TISSUE PAD FELL OFF THE CLAMP ARM. NO FURTHER INFORMATION WILL BE AVAILABLE. DID THE TISSUE PAD FALL INTO THE PATIENT? IF, SO WHAT EFFORTS WERE MADE TO RETRIEVE IT? NO PIECES FELL INTO THE PATIENT. NO FURTHER INFORMATION WILL BE AVAILABLE. ATTEMPTS HAVE BEEN MADE TO RETRIEVE THE DEVICE. TO DATE THE DEVICE HAS NOT BEEN RETURNED. IF THE DEVICE OR FURTHER DETAILS ARE RECEIVED AT A LATER DATE A SUPPLEMENTAL MEDWATCH WILL BE SENT. A MANUFACTURING RECORD EVALUATION WAS PERFORMED FOR THE FINISHED DEVICE LOT NUMBER, AND NO NON-CONFORMANCE WERE IDENTIFIED. IF INFORMATION IS OBTAINED THAT WAS NOT AVAILABLE FOR THE INITIAL REPORT, A FOLLOW-UP REPORT WILL BE FILED AS APPROPRIATE. (B)(4). DATE SENT: 3/23/2022. D4 BATCH #: V7012C. THE PRODUCT WAS RETURNED TO ETHICON ENDO SURGERY FOR EVALUATION. VISUAL INSPECTION AND FUNCTIONAL TESTING WERE CONDUCTED ON THE RETURNED DEVICE. THE DEVICE RECEIVED WAS RETURNED WITH THE TISSUE PAD WITH SIGNS OF NORMAL WEAR AND PROPERLY ATTACHED TO THE CLAMP ARM. THE TISSUE PAD WAS NOT DETACHED AS REPORTED. THE DEVICE WAS CONNECTED TO A GEN11. THE DEVICE WAS FUNCTIONAL AND WORKED AS INTENDED. THERE WERE NO ANOMALIES NOTED WITH THE FUNCTIONALITY OF THE DEVICE. THE DEVICE WAS DISASSEMBLED TO INSPECT THE INTERNAL COMPONENTS AND NO ANOMALIES WERE FOUND. THE EVENT DESCRIBED COULD NOT BE CONFIRMED AS THE DEVICE WAS RETURNED WITHOUT DETECTABLE DAMAGE. ALTHOUGH NO PRODUCT DEFECT WAS IDENTIFIED, THERE MAY HAVE BEEN OTHER CIRCUMSTANCES OR ISSUES THAT OCCURRED DURING THE USE OF THE DEVICE THAT COULD NOT BE REPLICATED DURING THE LABORATORY ANALYSIS. AS PART OF ETHICON ENDO SURGERY QUALITY PROCESS ALL DEVICES ARE MANUFACTURED, INSPECTED, AND RELEASED TO APPROVED SPECIFICATIONS. A MANUFACTURING RECORD EVALUATION WAS PERFORMED FOR THE FINISHED DEVICE BATCH NUMBER, AND NO NON-CONFORMANCES WERE IDENTIFIED."
HAR1136,13601318,"HARMONIC 1100 SHEARS, 36CM","ETHICON ENDO-SURGERY, LLC.",V7012C,,,20220131,Malfunction,"(B)(4). BATCH #: UNKNOWN. A MANUFACTURING RECORD EVALUATION WAS PERFORMED FOR THE FINISHED DEVICE LOT NUMBER, AND NO NON-CONFORMANCE WERE IDENTIFIED. IF INFORMATION IS OBTAINED THAT WAS NOT AVAILABLE FOR THE INITIAL REPORT, A FOLLOW-UP REPORT WILL BE FILED AS APPROPRIATE. IT WAS REPORTED THAT, DURING A THORACOSCOPIC PNEUMONECTOMY, AN UNKNOWN ERROR OCCURRED AND BECAME NOT TO FUNCTION AFTER THE DEVICE WAS ACTIVATED FOR 4 TO 5 TIMES. THE BLADE BROKE. NO PIECES FELL INTO THE PATIENT. GEN11 WAS USED. ANOTHER DEVICE WAS USED TO COMPLETE THE CASE. THERE WERE NO ADVERSE CONSEQUENCES TO THE PATIENT. NO FURTHER INFORMATION IS AVAILABLE. (B)(4). DATE SENT: 3/28/2022. INVESTIGATION SUMMARY: THE PRODUCT WAS RETURNED TO ETHICON ENDO SURGERY FOR EVALUATION. VISUAL INSPECTION AND FUNCTIONAL TESTING WERE CONDUCTED ON THE RETURNED DEVICE. THE DEVICE WAS RETURNED WITH THE BLADE TIP DAMAGED, HOWEVER, THE BLADE WAS NOT CRACKED. THE BLADE TIP WAS NOT BROKEN OFF AS REPORTED BY THE CUSTOMER. THE DEVICE WAS TESTED ON A GEN11. THE DEVICE DID ACTIVATE DURING FUNCTIONAL TESTING. THE DEVICE WAS DISASSEMBLED TO INSPECT THE INTERNAL COMPONENTS AND NO ANOMALIES WERE FOUND. IF THE DEVICE IS ACTIVATED ACROSS A CLIP, STAPLE LINE OR OTHER METAL IN THE JAWS, IT IS POSSIBLE THAT THE GENERATOR WILL DISPLAY AN ALERT SCREEN, AND AFTER RECEIVING TWO CONSECUTIVE ALERTS SCREENS A ""REPLACE INSTRUMENT"" ALERT SCREEN WILL BE DISPLAYED BY THE GENERATOR. ONCE MINOR BLADE DAMAGE HAS OCCURRED, SUBSEQUENT ACTIVATIONS MAY INCREASE THE SEVERITY OF THE BLADE DAMAGE. THIS IN TURN CAN RESULT IN ACTIVATION ISSUES SUCH AS FAILING THE PRE-RUN TEST WITH THE GENERATOR AND DISPLAYING AN ALERT SCREEN. THESE ALERT SCREENS THAT CAN RESULT ARE SUCH AS ""REMOVE INSTRUMENT FROM PATIENT"" OR ¿BLADE ERROR DETECTED¿ OR ""RELAXED PRESSURE ON BLADE"" FOLLOWED BY A ¿REPLACE INSTRUMENT¿ SCREEN LATER IN THE PROCEDURE. CONTINUED USAGE OF THE DAMAGE BLADE CAN RESULT IN A BROKEN BLADE. AS PART OF ETHICON ENDO SURGERY QUALITY PROCESS ALL DEVICES ARE MANUFACTURED, INSPECTED, AND RELEASED TO APPROVED SPECIFICATIONS. A MANUFACTURING RECORD EVALUATION WAS PERFORMED FOR THE FINISHED DEVICE BATCH NUMBER, AND NO NON-CONFORMANCES WERE IDENTIFIED."
HAR1136,13601366,"HARMONIC 1100 SHEARS, 36CM","ETHICON ENDO-SURGERY, LLC.",V7014U,,,20220131,Malfunction,"(B)(4). ` BATCH #: UNKNOWN. ADDITIONAL INFORMATION WAS REQUESTED AND THE FOLLOWING WAS OBTAINED: DID THE PATIENT EXPERIENCE ANY ADVERSE CONSEQUENCES DUE TO THIS ISSUE?  THE BLEEDING OCCURRED DURING THE DISSECTION. NO FURTHER INFORMATION WILL BE AVAILABLE. A MANUFACTURING RECORD EVALUATION WAS PERFORMED FOR THE FINISHED DEVICE LOT NUMBER, AND NO NON-CONFORMANCE WERE IDENTIFIED. IT WAS REPORTED THAT, DURING A LAPAROSCOPIC DISTAL GASTRECTOMY, ¿REMOVE INSTRUMENT FROM PATIENT¿ WAS DISPLAYED. THE SURGEON REMOVED THE DEVICE FROM THE PATIENT AND ACTIVATED, BUT AN UNEXPECTED HIGH SOUND WAS HEARD FROM THE BLADE. THEN THE BLADE BROKE WHEN THE DEVICE WAS CLEANED. THE DEVICE WAS USED ON THE BLOOD VESSELS. THE BLEEDING OCCURRED DURING THE DISSECTION, SO THE DEVICE WAS NOT CLEANED FREQUENTLY. THE DEVICE DID NOT CLAMP CLIPS OR THE FORCEPS. THE DEVICE CLAMPED HARD TUMOR. NO PIECES FELL INTO THE PATIENT. GEN11 WAS USED. ANOTHER DEVICE WAS USED TO COMPLETE THE CASE. NO FURTHER INFORMATION IS AVAILABLE. (B)(4). DATE SENT: 3/10/2022. D4 BATCH #: V7014U. INVESTIGATION SUMMARY: THE PRODUCT WAS RETURNED TO ETHICON ENDO SURGERY FOR EVALUATION. VISUAL INSPECTION AND FUNCTIONAL TESTING WERE CONDUCTED ON THE RETURNED DEVICE. THE DEVICE WAS RETURNED WITH THE DISTAL TIP OF THE BLADE BROKEN OFF AND IT WAS RETURNED WITH THE DEVICE. THE REMAINING BLADE PORTION WAS SCRATCHED, AND WITH EVIDENCE OF CONTACT WITH METAL IN OR OUT OF THE OPERATIVE FIELD. DURING FUNCTIONAL TESTING ON GEN11, AN ALERT SCREEN WAS DISPLAYED. A PROBABLE CAUSE FOR THE DEVICE TO STOP ACTIVATING AND THE GEN11 TO DISPLAY AN ALERT SCREEN IS BLADE DAMAGE. DUE TO THE DEVICE RETURNED CONDITION WE WERE UNABLE TO INVESTIGATE FURTHER THE REPORTED TISSUE HEMOSTASIS CONTROLLABLE THE DEVICE WAS DISASSEMBLED TO INSPECT THE INTERNAL COMPONENTS AND NO ANOMALIES WERE FOUND. PROBABLE CAUSES OF BLADE DAMAGE, INCLUDING BREAKAGE, ARE EXTERNAL CONTACT DURING PRE-OP OR GENERAL USE, BLADE CONTACT WITH OTHER DEVICES, STAPLES OR CLIPS DURING THE PROCEDURE. ONCE MINOR BLADE DAMAGE HAS OCCURRED, SUBSEQUENT ACTIVATIONS MAY INCREASE THE SEVERITY OF THE BLADE DAMAGE. THIS IN TURN CAN RESULT IN ACTIVATION ISSUES SUCH AS FAILING THE PRE-RUN TEST WITH THE GENERATOR AND DISPLAYING AN ALERT SCREEN. THESE ALERT SCREENS THAT CAN RESULT ARE SUCH AS ""REMOVE INSTRUMENT FROM PATIENT"" OR ¿BLADE ERROR DETECTED¿ OR ""RELAXED PRESSURE ON BLADE"" FOLLOWED BY A ¿REPLACE INSTRUMENT¿ SCREEN LATER IN THE PROCEDURE. CONTINUED USAGE OF THE DAMAGE BLADE CAN RESULT IN A BROKEN BLADE. IT IS POSSIBLE THAT THE REPORTED NOISE ISSUE COULD HAVE BEEN CAUSED BY METAL TO METAL CONTACT ONCE THE BLADE WAS DAMAGED. AS PART OF ETHICON ENDO SURGERY QUALITY PROCESS ALL DEVICES ARE MANUFACTURED, INSPECTED, AND RELEASED TO APPROVED SPECIFICATIONS. A MANUFACTURING RECORD EVALUATION WAS PERFORMED FOR THE FINISHED DEVICE BATCH NUMBER, AND NO NON-CONFORMANCES WERE IDENTIFIED. ADDITIONAL COMPLAINT INFORMATION MONITORING FOR POTENTIAL SAFETY SIGNALS WILL BE CONDUCTED THROUGH COMPLAINT TRENDING AS PART OF POST MARKET SURVEILLANCE."
HAR1136,13605768,"HARMONIC 1100 SHEARS, 36CM","ETHICON ENDO-SURGERY, LLC.",,,,20211201,Malfunction,"(B)(4). BATCH #: V7009P. ATTEMPTS ARE BEING MADE TO OBTAIN THE FOLLOWING INFORMATION. TO DATE, NO RESPONSE HAS BEEN PROVIDED. IF FURTHER DETAILS ARE RECEIVED AT A LATER DATE, A SUPPLEMENTAL MEDWATCH WILL BE SENT: CAN IT BE CONFIRMED IF THE BLADE TIP WAS PRESENT FOR THE ENTIRE USE OF THE HARMONIC 1100 DEVICE? WERE ACTIVE BLADE FRAGMENTS GENERATED? IF YES, WERE THEY REMOVED EASILY WITHOUT ADDITIONAL INTERVENTION? INVESTIGATION SUMMARY: THE PRODUCT WAS RETURNED TO ETHICON ENDO SURGERY FOR EVALUATION. VISUAL INSPECTION AND FUNCTIONAL TESTING WERE CONDUCTED ON THE RETURNED DEVICE. THE DEVICE WAS RETURNED WITH THE DISTAL TIP OF THE BLADE BROKEN OFF AND NOT RETURNED. THE REMAINING BLADE PORTION WAS SCRATCHED, AND WITH EVIDENCE OF CONTACT WITH METAL IN OR OUT OF THE OPERATIVE FIELD. THIS BLADE TIP PORTION MAY HAVE BROKEN OFF OF THE DEVICE DURING TRANSPORT TO OUR ANALYSIS SITE. DURING FUNCTIONAL TESTING ON GEN11, AN ALERT SCREEN WAS DISPLAYED. A PROBABLE CAUSE OF THE DEVICE STOP ACTIVATING AND DISPLAY AN ALERT SCREEN IS BLADE DAMAGE. THE DEVICE WAS DISASSEMBLED TO INSPECT THE INTERNAL COMPONENTS AND NO ANOMALIES WERE FOUND. PROBABLE CAUSES OF BLADE DAMAGE, INCLUDING BREAKAGE, ARE EXTERNAL CONTACT DURING PRE-OP OR GENERAL USE, BLADE CONTACT WITH OTHER DEVICES, STAPLES OR CLIPS DURING THE PROCEDURE. ONCE MINOR BLADE DAMAGE HAS OCCURRED, SUBSEQUENT ACTIVATIONS MAY INCREASE THE SEVERITY OF THE BLADE DAMAGE. THIS IN TURN CAN RESULT IN ACTIVATION ISSUES SUCH AS FAILING THE PRE-RUN TEST WITH THE GENERATOR AND DISPLAYING AN ALERT SCREEN. THESE ALERT SCREENS THAT CAN RESULT ARE SUCH AS ""REMOVE INSTRUMENT FROM PATIENT"" OR ¿BLADE ERROR DETECTED¿ OR ""RELAXED PRESSURE ON BLADE"" FOLLOWED BY A ¿REPLACE INSTRUMENT¿ SCREEN LATER IN THE PROCEDURE. CONTINUED USAGE OF THE DAMAGE BLADE CAN RESULT IN A BROKEN BLADE. AS PART OF ETHICON ENDO SURGERY QUALITY PROCESS ALL DEVICES ARE MANUFACTURED, INSPECTED, AND RELEASED TO APPROVED SPECIFICATIONS. A MANUFACTURING RECORD EVALUATION WAS PERFORMED FOR THE FINISHED DEVICE BATCH NUMBER, AND NO NON-CONFORMANCES WERE IDENTIFIED. ADDITIONAL COMPLAINT INFORMATION MONITORING FOR POTENTIAL SAFETY SIGNALS WILL BE CONDUCTED THROUGH COMPLAINT TRENDING AS PART OF POST MARKET SURVEILLANCE. IF INFORMATION IS OBTAINED THAT WAS NOT AVAILABLE FOR THE INITIAL REPORT, A FOLLOW-UP REPORT WILL BE FILED AS APPROPRIATE. IT WAS REPORTED THAT DURING AN UNKNOWN PROCEDURE THE DEVICE DID NOT WORK. THERE WERE NO PATIENT CONSEQUENCES. NO OTHER INFORMATION IS AVAILABLE."
HAR1136,13635974,"HARMONIC 1100 SHEARS, 36CM","ETHICON ENDO-SURGERY, LLC.",,,,20220111,Malfunction,"(B)(4). BATCH #: V70099. INVESTIGATION SUMMARY: THE PRODUCT WAS RETURNED TO ETHICON ENDO SURGERY FOR EVALUATION. VISUAL INSPECTION AND FUNCTIONAL TESTING WERE CONDUCTED ON THE RETURNED DEVICE. THE DEVICE WAS RETURNED WITH THE DISTAL TIP OF THE BLADE BROKEN OFF AND NOT RETURNED. THE REMAINING BLADE PORTION WAS SCRATCHED, AND WITH EVIDENCE OF CONTACT WITH METAL IN OR OUT OF THE OPERATIVE FIELD. DURING FUNCTIONAL TESTING ON GEN11, AN ALERT SCREEN WAS DISPLAYED. A PROBABLE CAUSE FOR THE DEVICE TO STOP ACTIVATING AND THE GEN11 TO DISPLAY AN ALERT SCREEN IS BLADE DAMAGE. THE DEVICE WAS DISASSEMBLED TO INSPECT THE INTERNAL COMPONENTS AND NO ANOMALIES WERE FOUND. PROBABLE CAUSES OF BLADE DAMAGE, INCLUDING BREAKAGE, ARE EXTERNAL CONTACT DURING PRE-OP OR GENERAL USE, BLADE CONTACT WITH OTHER DEVICES, STAPLES OR CLIPS DURING THE PROCEDURE. ONCE MINOR BLADE DAMAGE HAS OCCURRED, SUBSEQUENT ACTIVATIONS MAY INCREASE THE SEVERITY OF THE BLADE DAMAGE. THIS IN TURN CAN RESULT IN ACTIVATION ISSUES SUCH AS FAILING THE PRE-RUN TEST WITH THE GENERATOR AND DISPLAYING AN ALERT SCREEN. THESE ALERT SCREENS THAT CAN RESULT ARE SUCH AS ""REMOVE INSTRUMENT FROM PATIENT"" OR ¿BLADE ERROR DETECTED¿ OR ""RELAXED PRESSURE ON BLADE"" FOLLOWED BY A ¿REPLACE INSTRUMENT¿ SCREEN LATER IN THE PROCEDURE. CONTINUED USAGE OF THE DAMAGE BLADE CAN RESULT IN A BROKEN BLADE. AS PART OF ETHICON ENDO SURGERY QUALITY PROCESS ALL DEVICES ARE MANUFACTURED, INSPECTED, AND RELEASED TO APPROVED SPECIFICATIONS. A MANUFACTURING RECORD EVALUATION WAS PERFORMED FOR THE FINISHED DEVICE BATCH NUMBER, AND NO NON-CONFORMANCES WERE IDENTIFIED. ADDITIONAL COMPLAINT INFORMATION MONITORING FOR POTENTIAL SAFETY SIGNALS WILL BE CONDUCTED THROUGH COMPLAINT TRENDING AS PART OF POST MARKET SURVEILLANCE. IF INFORMATION IS OBTAINED THAT WAS NOT AVAILABLE FOR THE INITIAL REPORT, A FOLLOW-UP REPORT WILL BE FILED AS APPROPRIATE. IT WAS REPORTED THAT DURING A HIATAL HERNIA REPAIR THE DEVICE STOPPED WORKING, YIELDING THE MESSAGE 'REPLACE INSTRUMENT.' ANOTHER DEVICE WAS USED TO COMPLETE THE CASE WITH NO PATIENT CONSEQUENCES."
HAR1136,13691487,"HARMONIC 1100 SHEARS, 36CM","ETHICON ENDO-SURGERY, LLC.",V70099,,,20220101,Malfunction,"(B)(4). BATCH #: UNKNOWN. A MANUFACTURING RECORD EVALUATION WAS PERFORMED FOR THE FINISHED DEVICE LOT NUMBER, AND NO NON-CONFORMANCE WERE IDENTIFIED. IF INFORMATION IS OBTAINED THAT WAS NOT AVAILABLE FOR THE INITIAL REPORT, A FOLLOW-UP REPORT WILL BE FILED AS APPROPRIATE. IT WAS REPORTED THAT DURING A ROUX-EN-Y THE GRAPHITE TIP FELL OFF DURING PROCEDURE INSIDE PATIENT WHILE TRYING TO MAKE AN ENTEROTOMY IN SMALL BOWEL. IT WAS RETRIEVED. NO HARM TO PATIENT. (B)(4) DATE SENT: 3/21/2022 INVESTIGATION SUMMARY THE PRODUCT WAS RETURNED TO ETHICON ENDO SURGERY FOR EVALUATION. VISUAL INSPECTION AND FUNCTIONAL TESTING WERE CONDUCTED ON THE RETURNED DEVICE. THE DEVICE WAS RETURNED WITH THE DISTAL TIP OF THE BLADE BROKEN OFF AND IT WAS RETURNED WITH THE DEVICE. THE REMAINING BLADE PORTION WAS SCRATCHED, AND WITH EVIDENCE OF CONTACT WITH METAL IN OR OUT OF THE OPERATIVE FIELD. DURING FUNCTIONAL TESTING ON GEN11, AN ALERT SCREEN WAS DISPLAYED. A PROBABLE CAUSE FOR THE DEVICE TO STOP ACTIVATING AND THE GEN11 TO DISPLAY AN ALERT SCREEN IS BLADE DAMAGE. THE DEVICE WAS DISASSEMBLED TO INSPECT THE INTERNAL COMPONENTS AND NO ANOMALIES WERE FOUND. PROBABLE CAUSES OF BLADE DAMAGE, INCLUDING BREAKAGE, ARE EXTERNAL CONTACT DURING PRE-OP OR GENERAL USE, BLADE CONTACT WITH OTHER DEVICES, STAPLES OR CLIPS DURING THE PROCEDURE. ONCE MINOR BLADE DAMAGE HAS OCCURRED, SUBSEQUENT ACTIVATIONS MAY INCREASE THE SEVERITY OF THE BLADE DAMAGE. THIS IN TURN CAN RESULT IN ACTIVATION ISSUES SUCH AS FAILING THE PRE-RUN TEST WITH THE GENERATOR AND DISPLAYING AN ALERT SCREEN. THESE ALERT SCREENS THAT CAN RESULT ARE SUCH AS ""REMOVE INSTRUMENT FROM PATIENT"" OR ¿BLADE ERROR DETECTED¿ OR ""RELAXED PRESSURE ON BLADE"" FOLLOWED BY A ¿REPLACE INSTRUMENT¿ SCREEN LATER IN THE PROCEDURE. CONTINUED USAGE OF THE DAMAGE BLADE CAN RESULT IN A BROKEN BLADE. AS PART OF ETHICON ENDO SURGERY QUALITY PROCESS ALL DEVICES ARE MANUFACTURED, INSPECTED, AND RELEASED TO APPROVED SPECIFICATIONS. A MANUFACTURING RECORD EVALUATION WAS PERFORMED FOR THE FINISHED DEVICE BATCH NUMBER, AND NO NON-CONFORMANCES WERE IDENTIFIED."
HAR1136,13691494,"HARMONIC 1100 SHEARS, 36CM","ETHICON ENDO-SURGERY, LLC.",V70099,,,20220209,Malfunction,"IT WAS REPORTED THAT DURING THE LAP GASTRIC BYPASS, THE BLADE CRACKED. THE DEVICE WAS PUT INTO THE COLLECTION BIN AND THE TIP OF BLADE WAS COMPLETELY BROKEN OFF. THE BLADE TIP WILL BE RETURNED WITH THE DEVICE. WARNING WAS OBSERVED ON GEN11 AND THE DEVICE THAT WAS REPLACED. THE ASSISTING RESIDENT SAYS THE ERROR OCCURRED AFTER ACTIVATING ON STAPLE LINE. THE PROCEDURE WAS SUCCESSFULLY COMPLETED. THERE WERE FRAGMENTS GENERATED AND WERE REMOVED EASILY WITHOUT ADDITIONAL INTERVENTION. THERE WAS NO PATIENT HARM. (B)(4). BATCH #: UNKNOWN. A MANUFACTURING RECORD EVALUATION WAS PERFORMED FOR THE FINISHED DEVICE LOT NUMBER, AND NO NON-CONFORMANCE WERE IDENTIFIED. IF INFORMATION IS OBTAINED THAT WAS NOT AVAILABLE FOR THE INITIAL REPORT, A FOLLOW-UP REPORT WILL BE FILED AS APPROPRIATE. (B)(4). DATE SENT: 3/21/2022 INVESTIGATION SUMMARY THE PRODUCT WAS RETURNED TO ETHICON ENDO SURGERY FOR EVALUATION. VISUAL INSPECTION AND FUNCTIONAL TESTING WERE CONDUCTED ON THE RETURNED DEVICE. THE DEVICE WAS RETURNED WITH THE DISTAL TIP OF THE BLADE BROKEN OFF AND IT WAS RETURNED WITH THE DEVICE. THE REMAINING BLADE PORTION WAS SCRATCHED, AND WITH EVIDENCE OF CONTACT WITH METAL IN OR OUT OF THE OPERATIVE FIELD. DURING FUNCTIONAL TESTING ON GEN11, AN ALERT SCREEN WAS DISPLAYED. A PROBABLE CAUSE FOR THE DEVICE TO STOP ACTIVATING AND THE GEN11 TO DISPLAY AN ALERT SCREEN IS BLADE DAMAGE. THE DEVICE WAS ANALYZED, AND IT WAS DETERMINED THAT IT WAS USED IN MORE THAN ONE GENERATOR. THE DEVICE IS INTENDED TO BE USED WITH A SINGLE GENERATOR. IF THE DEVICE IS CONNECTED TO A DIFFERENT GENERATOR AN ALERT SCREEN WILL BE DISPLAYED INDICATING TO REPLACE THE INSTRUMENT / NO INSTRUMENT USES REMAINING / RESTART GENERATOR. THE DEVICE WAS DISASSEMBLED TO INSPECT THE INTERNAL COMPONENTS AND NO ANOMALIES WERE FOUND. PROBABLE CAUSES OF BLADE DAMAGE, INCLUDING BREAKAGE, ARE EXTERNAL CONTACT DURING PRE-OP OR GENERAL USE, BLADE CONTACT WITH OTHER DEVICES, STAPLES OR CLIPS DURING THE PROCEDURE. ONCE MINOR BLADE DAMAGE HAS OCCURRED, SUBSEQUENT ACTIVATIONS MAY INCREASE THE SEVERITY OF THE BLADE DAMAGE. THIS IN TURN CAN RESULT IN ACTIVATION ISSUES SUCH AS FAILING THE PRE-RUN TEST WITH THE GENERATOR AND DISPLAYING AN ALERT SCREEN. THESE ALERT SCREENS THAT CAN RESULT ARE SUCH AS ""REMOVE INSTRUMENT FROM PATIENT"" OR ¿BLADE ERROR DETECTED¿ OR ""RELAXED PRESSURE ON BLADE"" FOLLOWED BY A ¿REPLACE INSTRUMENT¿ SCREEN LATER IN THE PROCEDURE. CONTINUED USAGE OF THE DAMAGE BLADE CAN RESULT IN A BROKEN BLADE. THIS DEVICE IS PACKAGED AND STERILIZED FOR SINGLE USE ONLY. MULTIPLE PATIENT USE MAY COMPROMISE THE DEVICE INTEGRITY OR CREATE A RISK OF CONTAMINATION THAT, IN TURN, MAY RESULT IN PATIENT INJURY OR ILLNESS. AS PART OF ETHICON ENDO SURGERY QUALITY PROCESS ALL DEVICES ARE MANUFACTURED, INSPECTED, AND RELEASED TO APPROVED SPECIFICATIONS. A MANUFACTURING RECORD EVALUATION WAS PERFORMED FOR THE FINISHED DEVICE BATCH NUMBER, AND NO NON-CONFORMANCES WERE IDENTIFIED."
