Searched CAT,MDR Report Key,Brand Name,Manufacturer,Lot Number,Problem Codes,Health Effect Codes,Date of Event,Type of Event,Description
HAR1136,12908636,"HARMONIC 1100 SHEARS, 36CM","ETHICON ENDO-SURGERY, LLC.",,,,20211108,Malfunction,"(B)(4). BATCH #: UNKNOWN. AN ANALYSIS OF THE PRODUCT COULD NOT BE PERFORMED SINCE A PHYSICAL SAMPLE WAS NOT RECEIVED FOR EVALUATION. AN EVALUATION OF THE MANUFACTURING DOCUMENTATION COULD NOT BE COMPLETED AS THE LOT NUMBER WAS NOT PROVIDED. AS PART OF ETHICON'S QUALITY PROCESS, ALL DEVICES ARE MANUFACTURED, INSPECTED, AND DISTRIBUTED TO APPROVED SPECIFICATIONS. ADDITIONAL COMPLAINT INFORMATION MONITORING FOR POTENTIAL SAFETY SIGNALS WILL BE CONDUCTED THROUGH COMPLAINT TRENDING AS PART OF POST MARKET SURVEILLANCE. IF THE PRODUCT OR ADDITIONAL INFORMATION IS RECEIVED AT A LATER DATE, THE INVESTIGATION WILL BE UPDATED AS APPLICABLE. IF INFORMATION IS OBTAINED THAT WAS NOT AVAILABLE FOR THE INITIAL REPORT, A FOLLOW-UP REPORT WILL BE FILED AS APPROPRIATE. IT WAS REPORTED THAT, DURING A LAPAROSCOPIC COLECTOMY, THE ALERT SOUND WHEN THE DEVICE ACTIVATED WITHOUT CLAMPING TISSUE WAS HEARD ABOUT 3 TO 5 SECONDS ALTHOUGH THE DEVICE STOPPED THE ACTIVATION AND RELEASED FROM THE TARGET TISSUE. THE BLADE TIP WAS NOT BROKEN OFF AND NO PIECES FELL INTO THE PATIENT. GEN11 WAS USED. ANOTHER DEVICE WAS USED TO COMPLETE THE CASE. THERE WERE NO ADVERSE CONSEQUENCES TO THE PATIENT. NO FURTHER INFORMATION IS AVAILABLE."
HAR1136,12928328,"HARMONIC 1100 SHEARS, 36CM","ETHICON ENDO-SURGERY, LLC.",,,,20211005,Malfunction,"(B)(4). BATCH #: V7002K. INVESTIGATION SUMMARY: THE PRODUCT WAS RETURNED TO ETHICON ENDO SURGERY FOR EVALUATION. VISUAL INSPECTION AND FUNCTIONAL TESTING WERE CONDUCTED ON THE RETURNED DEVICE. THE DEVICE WAS RETURNED WITH THE DISTAL TIP OF THE BLADE BROKEN OFF AND NOT RETURNED. THE REMAINING BLADE PORTION WAS SCRATCHED, AND WITH EVIDENCE OF CONTACT WITH METAL IN OR OUT OF THE OPERATIVE FIELD. THIS BLADE TIP PORTION MAY HAVE BROKEN OFF OF THE DEVICE DURING TRANSPORT TO OUR ANALYSIS SITE. DURING FUNCTIONAL TESTING ON GEN11, AN ALERT SCREEN WAS DISPLAYED. A PROBABLE CAUSE OF THE DEVICE STOP ACTIVATING AND DISPLAY AN ALERT SCREEN IS BLADE DAMAGE. THE DEVICE WAS DISASSEMBLED TO INSPECT THE INTERNAL COMPONENTS AND NO ANOMALIES WERE FOUND. PROBABLE CAUSES OF BLADE DAMAGE, INCLUDING BREAKAGE, ARE EXTERNAL CONTACT DURING PRE-OP OR GENERAL USE, BLADE CONTACT WITH OTHER DEVICES, STAPLES OR CLIPS DURING THE PROCEDURE. ONCE MINOR BLADE DAMAGE HAS OCCURRED, SUBSEQUENT ACTIVATIONS MAY INCREASE THE SEVERITY OF THE BLADE DAMAGE. THIS IN TURN CAN RESULT IN ACTIVATION ISSUES SUCH AS FAILING THE PRE-RUN TEST WITH THE GENERATOR AND DISPLAYING AN ALERT SCREEN. THESE ALERT SCREENS THAT CAN RESULT ARE SUCH AS ""REMOVE INSTRUMENT FROM PATIENT"" OR ¿BLADE ERROR DETECTED¿ OR ""RELAXED PRESSURE ON BLADE"" FOLLOWED BY A ¿REPLACE INSTRUMENT¿ SCREEN LATER IN THE PROCEDURE. CONTINUED USAGE OF THE DAMAGE BLADE CAN RESULT IN A BROKEN BLADE. AS PART OF ETHICON ENDO SURGERY QUALITY PROCESS ALL DEVICES ARE MANUFACTURED, INSPECTED, AND RELEASED TO APPROVED SPECIFICATIONS. A MANUFACTURING RECORD EVALUATION WAS PERFORMED FOR THE FINISHED DEVICE BATCH NUMBER, AND NO NON-CONFORMANCES RELATED TO THE REPORTED COMPLAINT CONDITION WERE IDENTIFIED. ADDITIONAL COMPLAINT INFORMATION MONITORING FOR POTENTIAL SAFETY SIGNALS WILL BE CONDUCTED THROUGH COMPLAINT TRENDING AS PART OF POST MARKET SURVEILLANCE. IF INFORMATION IS OBTAINED THAT WAS NOT AVAILABLE FOR THE INITIAL REPORT, A FOLLOW-UP REPORT WILL BE FILED AS APPROPRIATE. IT WAS REPORTED THAT DURING A LAPAROSCOPIC ROUX-EN-Y GASTRIC BYPASS PROCEDURE, DURING USE, THE DEVICE ALARMED WITH PROMPTS OF CLEAN OFF END OF DEVICE, TEST DEVICE OUTSIDE OF PATIENT. PROMPTS WERE COMPLETED BUT DEVICE ALARMED AGAIN TO REPLACE THE DEVICE. ANOTHER LIKE DEVICE WAS USED TO COMPLETE THE PROCEDURE. THERE WERE NO ADVERSE CONSEQUENCES FOR THE PATIENT."
HAR1136,12962608,"HARMONIC 1100 SHEARS, 36CM","ETHICON ENDO-SURGERY, LLC.",V7012C,,,20211116,Malfunction,"IT WAS REPORTED THAT, DURING A TRANSANAL TOTAL MESORECTAL EXCISION, THE BLADE BROKE. NO PIECES FELL INTO THE PATIENT. THE BROKEN BLADE WAS RETRIEVED AND HAS BEEN DISCARDED. THE DEVICE WAS REPLACED. THERE WERE NO ADVERSE CONSEQUENCES TO THE PATIENT. NO FURTHER INFORMATION IS AVAILABLE. (B)(4). BATCH #: UNKNOWN. ATTEMPTS HAVE BEEN MADE TO RETRIEVE THE DEVICE. TO DATE THE DEVICE HAS NOT BEEN RETURNED. IF THE DEVICE OR FURTHER DETAILS ARE RECEIVED AT A LATER DATE A SUPPLEMENTAL MEDWATCH WILL BE SENT. THE LOT/BATCH WAS NOT PROVIDED; THEREFORE, THE MANUFACTURING RECORDS EVALUATION COULD NOT BE PERFORMED. (B)(4). DATE SENT: 12/9/2021. INVESTIGATION SUMMARY: THE PRODUCT WAS RETURNED TO ETHICON ENDO SURGERY FOR EVALUATION. VISUAL INSPECTION AND FUNCTIONAL TESTING WERE CONDUCTED ON THE RETURNED DEVICE. THE DEVICE WAS RETURNED WITH THE DISTAL TIP OF THE BLADE BROKEN OFF AND NOT RETURNED. THE REMAINING BLADE PORTION WAS SCRATCHED, AND WITH EVIDENCE OF CONTACT WITH METAL IN OR OUT OF THE OPERATIVE FIELD. DURING FUNCTIONAL TESTING ON GEN11, AN ALERT SCREEN WAS DISPLAYED. A PROBABLE CAUSE FOR THE DEVICE TO STOP ACTIVATING AND THE GEN11 TO DISPLAY AN ALERT SCREEN IS BLADE DAMAGE. THE DEVICE WAS DISASSEMBLED TO INSPECT THE INTERNAL COMPONENTS AND NO ANOMALIES WERE FOUND. PROBABLE CAUSES OF BLADE DAMAGE, INCLUDING BREAKAGE, ARE EXTERNAL CONTACT DURING PRE-OP OR GENERAL USE, BLADE CONTACT WITH OTHER DEVICES, STAPLES OR CLIPS DURING THE PROCEDURE. ONCE MINOR BLADE DAMAGE HAS OCCURRED, SUBSEQUENT ACTIVATIONS MAY INCREASE THE SEVERITY OF THE BLADE DAMAGE. THIS IN TURN CAN RESULT IN ACTIVATION ISSUES SUCH AS FAILING THE PRE-RUN TEST WITH THE GENERATOR AND DISPLAYING AN ALERT SCREEN. THESE ALERT SCREENS THAT CAN RESULT ARE SUCH AS ""REMOVE INSTRUMENT FROM PATIENT"" OR ¿BLADE ERROR DETECTED¿ OR ""RELAXED PRESSURE ON BLADE"" FOLLOWED BY A ¿REPLACE INSTRUMENT¿ SCREEN LATER IN THE PROCEDURE. CONTINUED USAGE OF THE DAMAGE BLADE CAN RESULT IN A BROKEN BLADE. AS PART OF ETHICON ENDO SURGERY QUALITY PROCESS ALL DEVICES ARE MANUFACTURED, INSPECTED, AND RELEASED TO APPROVED SPECIFICATIONS. A MANUFACTURING RECORD EVALUATION WAS PERFORMED FOR THE FINISHED DEVICE BATCH NUMBER, AND NO NON-CONFORMANCES WERE IDENTIFIED."
HAR1136,12963261,"HARMONIC 1100 SHEARS, 36CM","ETHICON ENDO-SURGERY, LLC.",,,,20211118,Malfunction,"(B)(4). DATE SENT: 12/29/2021. PC-(B)(4). DATE SENT: 1/13/2022. INVESTIGATION SUMMARY THE PRODUCT WAS RETURNED TO ETHICON ENDO SURGERY FOR EVALUATION. VISUAL INSPECTION AND FUNCTIONAL TESTING WERE CONDUCTED ON THE RETURNED DEVICE. THE DEVICE WAS RETURNED WITH THE DISTAL TIP OF THE BLADE BROKEN OFF AND NOT RETURNED. THE REMAINING BLADE PORTION WAS SCRATCHED, AND WITH EVIDENCE OF CONTACT WITH METAL IN OR OUT OF THE OPERATIVE FIELD. DURING FUNCTIONAL TESTING ON GEN11, AN ALERT SCREEN WAS DISPLAYED. A PROBABLE CAUSE FOR THE DEVICE TO STOP ACTIVATING AND THE GEN11 TO DISPLAY AN ALERT SCREEN IS BLADE DAMAGE. THE DEVICE WAS DISASSEMBLED TO INSPECT THE INTERNAL COMPONENTS AND NO ANOMALIES WERE FOUND. PROBABLE CAUSES OF BLADE DAMAGE, INCLUDING BREAKAGE, ARE EXTERNAL CONTACT DURING PRE-OP OR GENERAL USE, BLADE CONTACT WITH OTHER DEVICES, STAPLES OR CLIPS DURING THE PROCEDURE. ONCE MINOR BLADE DAMAGE HAS OCCURRED, SUBSEQUENT ACTIVATIONS MAY INCREASE THE SEVERITY OF THE BLADE DAMAGE. THIS IN TURN CAN RESULT IN ACTIVATION ISSUES SUCH AS FAILING THE PRE-RUN TEST WITH THE GENERATOR AND DISPLAYING AN ALERT SCREEN. THESE ALERT SCREENS THAT CAN RESULT ARE SUCH AS ""REMOVE INSTRUMENT FROM PATIENT"" OR ¿BLADE ERROR DETECTED¿ OR ""RELAXED PRESSURE ON BLADE"" FOLLOWED BY A ¿REPLACE INSTRUMENT¿ SCREEN LATER IN THE PROCEDURE. CONTINUED USAGE OF THE DAMAGE BLADE CAN RESULT IN A BROKEN BLADE. AS PART OF ETHICON ENDO SURGERY QUALITY PROCESS ALL DEVICES ARE MANUFACTURED, INSPECTED, AND RELEASED TO APPROVED SPECIFICATIONS. A MANUFACTURING RECORD EVALUATION WAS PERFORMED FOR THE FINISHED DEVICE BATCH NUMBER, AND NO NON-CONFORMANCES WERE IDENTIFIED. ADDITIONAL COMPLAINT INFORMATION MONITORING FOR POTENTIAL SAFETY SIGNALS WILL BE CONDUCTED THROUGH COMPLAINT TRENDING AS PART OF POST MARKET SURVEILLANCE. IT WAS REPORTED THAT, DURING A LAPAROSCOPIC COLON AND UROLOGICAL SURGERY, THE BLADE BROKE. NO PIECES FELL INTO THE PATIENT. THE DEVICE WAS USED ON THE BLOOD VESSELS. ANOTHER DEVICE WAS USED TO COMPLETE THE CASE. THERE WERE NO ADVERSE CONSEQUENCES TO THE PATIENT. NO FURTHER INFORMATION IS AVAILABLE. (B)(4) BATCH #: UNKNOWN. ATTEMPTS HAVE BEEN MADE TO RETRIEVE THE DEVICE. TO DATE THE DEVICE HAS NOT BEEN RETURNED. IF THE DEVICE OR FURTHER DETAILS ARE RECEIVED AT A LATER DATE A SUPPLEMENTAL MEDWATCH WILL BE SENT. THE LOT/BATCH WAS NOT PROVIDED; THEREFORE, THE MANUFACTURING RECORDS EVALUATION COULD NOT BE PERFORMED."
HAR1136,12984689,"HARMONIC 1100 SHEARS, 36CM","ETHICON ENDO-SURGERY, LLC.",,,,20211117,Malfunction,"IT WAS REPORTED THAT DURING AN UNKNOWN CASE, THE TIP BROKE OFF. END WAS RETRIEVED SUCCESSFULLY. NO PATIENT CONSEQUENCES. (B)(4). BATCH #: UNKNOWN. THE LOT/BATCH WAS NOT PROVIDED; THEREFORE, THE MANUFACTURING RECORDS EVALUATION COULD NOT BE PERFORMED. IF INFORMATION IS OBTAINED THAT WAS NOT AVAILABLE FOR THE INITIAL REPORT, A FOLLOW-UP REPORT WILL BE FILED AS APPROPRIATE. (B)(6). DATE SENT: 12/22/2021. INVESTIGATION SUMMARY : THE PRODUCT WAS RETURNED TO ETHICON ENDO SURGERY FOR EVALUATION. VISUAL INSPECTION AND FUNCTIONAL TESTING WERE CONDUCTED ON THE RETURNED DEVICE. THE DEVICE WAS RETURNED WITH THE DISTAL TIP OF THE BLADE BROKEN OFF AND IT WAS RETURNED WITH THE DEVICE. THE REMAINING BLADE PORTION WAS SCRATCHED, AND WITH EVIDENCE OF CONTACT WITH METAL IN OR OUT OF THE OPERATIVE FIELD. DURING FUNCTIONAL TESTING ON GEN11, AN ALERT SCREEN WAS DISPLAYED. A PROBABLE CAUSE FOR THE DEVICE TO STOP ACTIVATING AND THE GEN11 TO DISPLAY AN ALERT SCREEN IS BLADE DAMAGE. THE DEVICE WAS DISASSEMBLED TO INSPECT THE INTERNAL COMPONENTS AND NO ANOMALIES WERE FOUND. PROBABLE CAUSES OF BLADE DAMAGE, INCLUDING BREAKAGE, ARE EXTERNAL CONTACT DURING PRE-OP OR GENERAL USE, BLADE CONTACT WITH OTHER DEVICES, STAPLES OR CLIPS DURING THE PROCEDURE. ONCE MINOR BLADE DAMAGE HAS OCCURRED, SUBSEQUENT ACTIVATIONS MAY INCREASE THE SEVERITY OF THE BLADE DAMAGE. THIS IN TURN CAN RESULT IN ACTIVATION ISSUES SUCH AS FAILING THE PRE-RUN TEST WITH THE GENERATOR AND DISPLAYING AN ALERT SCREEN. THESE ALERT SCREENS THAT CAN RESULT ARE SUCH AS ""REMOVE INSTRUMENT FROM PATIENT"" OR ¿BLADE ERROR DETECTED¿ OR ""RELAXED PRESSURE ON BLADE"" FOLLOWED BY A ¿REPLACE INSTRUMENT¿ SCREEN LATER IN THE PROCEDURE. CONTINUED USAGE OF THE DAMAGE BLADE CAN RESULT IN A BROKEN BLADE. AS PART OF ETHICON ENDO SURGERY QUALITY PROCESS ALL DEVICES ARE MANUFACTURED, INSPECTED, AND RELEASED TO APPROVED SPECIFICATIONS. A MANUFACTURING RECORD EVALUATION WAS PERFORMED FOR THE FINISHED DEVICE BATCH NUMBER, AND NO NON-CONFORMANCES RELATED TO THE REPORTED COMPLAINT CONDITION WERE IDENTIFIED. ADDITIONAL COMPLAINT INFORMATION MONITORING FOR POTENTIAL SAFETY SIGNALS WILL BE CONDUCTED THROUGH COMPLAINT TRENDING AS PART OF POST MARKET SURVEILLANCE."
HAR1136,13019090,ETHICON HARMONIC 1100 LAPAROSCOPIC SHEARS,"ETHICON ENDO-SURGERY, LLC",V7009X,,,20211207,Injury,"SURGEON HAS USED THE ETHICON HARMONIC 1100 LAPAROSCOPIC SHEARS FOR APPROXIMATELY 5-10 MINUTES AND IT STOPPED WORKING. ON THE SCREEN IT SHOWED, ""CLEAN BLADE"". AFTER CLEANING ITS BLADE, IT SHOWED "" REPLACE INSTRUMENT"". THE ITEM WAS REPLACED. AFTER APPROXIMATELY 5-10 MINUTES OF USAGE, NEW ITEM ALSO STOPPED WORKING AND THE SAME MESSAGES APPEARED ON SCREEN. BOTH SURGEON AND SCRUB TECH HAVE CONFIRMED THAT BOTH ITEMS HAVE NOT COME IN CONTACT WITH ANY METAL, PARTICULARLY THE METAL PART OF THE UTERINE MANIPULATOR. FDA SAFETY REPORT ID# (B)(4)."
HAR1136,13027762,"HARMONIC 1100 SHEARS, 36CM","ETHICON ENDO-SURGERY, LLC.",,,,20211124,Malfunction,"(B)(4). BATCH #: UNKNOWN. ATTEMPTS HAVE BEEN MADE TO RETRIEVE THE DEVICE. TO DATE THE DEVICE HAS NOT BEEN RETURNED. IF THE DEVICE OR FURTHER DETAILS ARE RECEIVED AT A LATER DATE A SUPPLEMENTAL MEDWATCH WILL BE SENT. THE LOT/BATCH WAS NOT PROVIDED; THEREFORE, THE MANUFACTURING RECORDS EVALUATION COULD NOT BE PERFORMED. IT WAS REPORTED THAT, DURING A LAPAROSCOPIC HARTMANN'S OPERATION, ¿CLEAN BLADE¿ WAS DISPLAYED AFTER THE DEVICE AS USED FOR 3 HOURS. THE BLADE BROKE WHEN CLEANING THE BLADE. NO PIECES FELL INTO THE PATIENT. ANOTHER DEVICE WAS USED TO COMPLETE THE CASE. THERE WERE NO ADVERSE CONSEQUENCES TO THE PATIENT. NO FURTHER INFORMATION IS AVAILABLE. (B)(4). DATE SENT: 1/24/2022. D4 BATCH #: V7009P . INVESTIGATION SUMMARY THE PRODUCT WAS RETURNED TO ETHICON ENDO SURGERY FOR EVALUATION. VISUAL INSPECTION AND FUNCTIONAL TESTING WERE CONDUCTED ON THE RETURNED DEVICE. THE DEVICE WAS RETURNED WITH THE DISTAL TIP OF THE BLADE BROKEN OFF AND RETURNED. THE REMAINING BLADE PORTION WAS SCRATCHED, AND WITH EVIDENCE OF CONTACT WITH METAL IN OR OUT OF THE OPERATIVE FIELD. DURING FUNCTIONAL TESTING ON GEN11, AN ALERT SCREEN WAS DISPLAYED. A PROBABLE CAUSE FOR THE DEVICE TO STOP ACTIVATING AND THE GEN11 TO DISPLAY AN ALERT SCREEN IS BLADE DAMAGE. THE DEVICE WAS DISASSEMBLED TO INSPECT THE INTERNAL COMPONENTS AND NO ANOMALIES WERE FOUND. PROBABLE CAUSES OF BLADE DAMAGE, INCLUDING BREAKAGE, ARE EXTERNAL CONTACT DURING PRE-OP OR GENERAL USE, BLADE CONTACT WITH OTHER DEVICES, STAPLES OR CLIPS DURING THE PROCEDURE. ONCE MINOR BLADE DAMAGE HAS OCCURRED, SUBSEQUENT ACTIVATIONS MAY INCREASE THE SEVERITY OF THE BLADE DAMAGE. THIS IN TURN CAN RESULT IN ACTIVATION ISSUES SUCH AS FAILING THE PRE-RUN TEST WITH THE GENERATOR AND DISPLAYING AN ALERT SCREEN. THESE ALERT SCREENS THAT CAN RESULT ARE SUCH AS ""REMOVE INSTRUMENT FROM PATIENT"" OR ¿BLADE ERROR DETECTED¿ OR ""RELAXED PRESSURE ON BLADE"" FOLLOWED BY A ¿REPLACE INSTRUMENT¿ SCREEN LATER IN THE PROCEDURE. CONTINUED USAGE OF THE DAMAGE BLADE CAN RESULT IN A BROKEN BLADE. AS PART OF ETHICON ENDO SURGERY QUALITY PROCESS ALL DEVICES ARE MANUFACTURED, INSPECTED, AND RELEASED TO APPROVED SPECIFICATIONS. A MANUFACTURING RECORD EVALUATION WAS PERFORMED FOR THE FINISHED DEVICE BATCH NUMBER, AND NO NON-CONFORMANCES WERE IDENTIFIED. ADDITIONAL COMPLAINT INFORMATION MONITORING FOR POTENTIAL SAFETY SIGNALS WILL BE CONDUCTED THROUGH COMPLAINT TRENDING AS PART OF POST MARKET SURVEILLANCE."
HAR1136,13040488,"HARMONIC 1100 SHEARS, 36CM","ETHICON ENDO-SURGERY, LLC.",V7009P,,,20211203,Malfunction,"(B)(4) DATE SENT: 2/2/2022 INVESTIGATION SUMMARY THE PRODUCT WAS RETURNED TO ETHICON ENDO SURGERY FOR EVALUATION. VISUAL INSPECTION AND FUNCTIONAL TESTING WERE CONDUCTED ON THE RETURNED DEVICE. THE DEVICE WAS RETURNED WITH THE DISTAL TIP OF THE BLADE BROKEN OFF AND IT WAS RETURNED WITH THE DEVICE. THE REMAINING BLADE PORTION WAS SCRATCHED, AND WITH EVIDENCE OF CONTACT WITH METAL IN OR OUT OF THE OPERATIVE FIELD. DURING FUNCTIONAL TESTING ON GEN11, AN ALERT SCREEN WAS DISPLAYED. A PROBABLE CAUSE FOR THE DEVICE TO STOP ACTIVATING AND THE GEN11 TO DISPLAY AN ALERT SCREEN IS BLADE DAMAGE. THE DEVICE WAS DISASSEMBLED TO INSPECT THE INTERNAL COMPONENTS AND NO ANOMALIES WERE FOUND. PROBABLE CAUSES OF BLADE DAMAGE, INCLUDING BREAKAGE, ARE EXTERNAL CONTACT DURING PRE-OP OR GENERAL USE, BLADE CONTACT WITH OTHER DEVICES, STAPLES OR CLIPS DURING THE PROCEDURE. ONCE MINOR BLADE DAMAGE HAS OCCURRED, SUBSEQUENT ACTIVATIONS MAY INCREASE THE SEVERITY OF THE BLADE DAMAGE. THIS IN TURN CAN RESULT IN ACTIVATION ISSUES SUCH AS FAILING THE PRE-RUN TEST WITH THE GENERATOR AND DISPLAYING AN ALERT SCREEN. THESE ALERT SCREENS THAT CAN RESULT ARE SUCH AS ""REMOVE INSTRUMENT FROM PATIENT"" OR ¿BLADE ERROR DETECTED¿ OR ""RELAXED PRESSURE ON BLADE"" FOLLOWED BY A ¿REPLACE INSTRUMENT¿ SCREEN LATER IN THE PROCEDURE. CONTINUED USAGE OF THE DAMAGE BLADE CAN RESULT IN A BROKEN BLADE. AS PART OF ETHICON ENDO SURGERY QUALITY PROCESS ALL DEVICES ARE MANUFACTURED, INSPECTED, AND RELEASED TO APPROVED SPECIFICATIONS. A MANUFACTURING RECORD EVALUATION WAS PERFORMED FOR THE FINISHED DEVICE BATCH NUMBER, AND NO NON-CONFORMANCES WERE IDENTIFIED. ADDITIONAL COMPLAINT INFORMATION MONITORING FOR POTENTIAL SAFETY SIGNALS WILL BE CONDUCTED THROUGH COMPLAINT TRENDING AS PART OF POST MARKET SURVEILLANCE. IT WAS REPORTED THAT, DURING A LAPAROSCOPIC RIGHT HEMICOLECTOMY, ¿CLEAN BLADE¿ WAS DISPLAYED AFTER THE DEVICE WAS USED FOR 1 HOUR. THEN THE BLADE BROKE WHEN THE DEVICE WAS CLEANED BY THE GAUZE. THE BROKEN PIECE FELL ONTO THE MAYO-TABLE AND HAS BEEN RETRIEVED. NO PIECES FELL INTO THE PATIENT. ANOTHER DEVICE WAS USED TO COMPLETE THE CASE. THERE WERE NO ADVERSE CONSEQUENCES TO THE PATIENT. NO FURTHER INFORMATION IS AVAILABLE. PC-(B)(4). BATCH #: UNKNOWN. ATTEMPTS HAVE BEEN MADE TO RETRIEVE THE DEVICE. TO DATE THE DEVICE HAS NOT BEEN RETURNED. IF THE DEVICE OR FURTHER DETAILS ARE RECEIVED AT A LATER DATE A SUPPLEMENTAL MEDWATCH WILL BE SENT. A MANUFACTURING RECORD EVALUATION WAS PERFORMED FOR THE FINISHED DEVICE AND THE MANUFACTURING CRITERIA WERE MET PRIOR TO THE RELEASE OF THIS LOT/BATCH. (B)(4). DATE SENT: 1/31/2022."
HAR1136,13046366,"HARMONIC 1100 SHEARS, 36CM","ETHICON ENDO-SURGERY, LLC.",V7009D,,,20211020,Malfunction,"IT WAS REPORTED THAT DURING A LAPAROSCOPIC SLEEVE GASTRECTOMY PROCEDURE THAT IMMEDIATELY AFTER CONNECTING TO THE GENERATOR THE GENERATOR GAVE REPLACE INSTRUMENT ERROR MESSAGE. A SECOND DEVICE WAS PLUGGED IN TO THE SAME GENERATOR WITH THE SAME ERROR MESSAGE. A SECOND GENERATOR WITH THE SECOND DEVICE WAS USED TO COMPLETE THE PROCEDURE. THERE WERE NO ADVERSE CONSEQUENCES FOR THE PATIENT. (B)(4). BATCH # UNK. INVESTIGATION SUMMARY: THE PRODUCT WAS RETURNED TO ETHICON ENDO SURGERY FOR EVALUATION. VISUAL INSPECTION AND FUNCTIONAL TESTING WERE CONDUCTED ON THE RETURNED DEVICE. THE DEVICE WAS RETURNED WITH THE DISTAL TIP OF THE BLADE BROKEN OFF AND NOT RETURNED. THE REMAINING BLADE PORTION WAS SCRATCHED, AND WITH EVIDENCE OF CONTACT WITH METAL IN OR OUT OF THE OPERATIVE FIELD. THIS BLADE TIP PORTION MAY HAVE BROKEN OFF OF THE DEVICE DURING TRANSPORT TO OUR ANALYSIS SITE. DURING FUNCTIONAL TESTING ON GEN11, AN ALERT SCREEN WAS DISPLAYED. A PROBABLE CAUSE OF THE DEVICE STOP ACTIVATING AND DISPLAY AN ALERT SCREEN IS BLADE DAMAGE. THE DEVICE WAS DISASSEMBLED TO INSPECT THE INTERNAL COMPONENTS AND NO ANOMALIES WERE FOUND. PROBABLE CAUSES OF BLADE DAMAGE, INCLUDING BREAKAGE, ARE EXTERNAL CONTACT DURING PRE-OP OR GENERAL USE, BLADE CONTACT WITH OTHER DEVICES, STAPLES OR CLIPS DURING THE PROCEDURE. ONCE MINOR BLADE DAMAGE HAS OCCURRED, SUBSEQUENT ACTIVATIONS MAY INCREASE THE SEVERITY OF THE BLADE DAMAGE. THIS IN TURN CAN RESULT IN ACTIVATION ISSUES SUCH AS FAILING THE PRE-RUN TEST WITH THE GENERATOR AND DISPLAYING AN ALERT SCREEN. THESE ALERT SCREENS THAT CAN RESULT ARE SUCH AS ""REMOVE INSTRUMENT FROM PATIENT"" OR ¿BLADE ERROR DETECTED¿ OR ""RELAXED PRESSURE ON BLADE"" FOLLOWED BY A ¿REPLACE INSTRUMENT¿ SCREEN LATER IN THE PROCEDURE. CONTINUED USAGE OF THE DAMAGE BLADE CAN RESULT IN A BROKEN BLADE. AS PART OF ETHICON ENDO SURGERY QUALITY PROCESS ALL DEVICES ARE MANUFACTURED, INSPECTED, AND RELEASED TO APPROVED SPECIFICATIONS. A MANUFACTURING RECORD EVALUATION WAS PERFORMED FOR THE FINISHED DEVICE BATCH NUMBER, AND NO NON-CONFORMANCES WERE IDENTIFIED. ADDITIONAL INFORMATION WAS REQUESTED, AND THE FOLLOWING WAS OBTAINED: CAN IT BE CONFIRMED THE BLADE TIP WAS PRESENT FOR THE ENTIRE PROCEDURE? WAS TOLD BY OR SUPERVISOR WHO WAS IN THE ROOM CIRCULATING THAT THE DEVICE WAS NOT USED ON / IN THE PATIENT. WHEN IT WAS PLUGGED IN THE DEVICE ERRORED OUT DURING THE INITIAL TESTING WITH GEN11. IF INFORMATION IS OBTAINED THAT WAS NOT AVAILABLE FOR THE INITIAL REPORT, A FOLLOW-UP REPORT WILL BE FILED AS APPROPRIATE."
HAR1136,13048207,"HARMONIC 1100 SHEARS, 36CM","ETHICON ENDO-SURGERY, LLC.",,,,20210101,Malfunction,"(B)(4). BATCH #: V7007F. ADDITIONAL INFORMATION WAS REQUESTED AND THE FOLLOWING WAS OBTAINED: AN INTERNAL RAPID RESPONSE CALL WAS HELD ON 12/15/2021 TO INCLUDE POST MARKET SURVEILLANCE, CUSTOMER QUALITY, QUALITY ENGINEERING, SALES, DESIGN ENGINEERING, AND LOCAL ASSOCIATES TO DISCUSS THE REPLACE INSTRUMENT ERRORS. THE REPS INDICATED THAT THE AFFECTED SURGEON IS A BARIATRIC DOCTOR IN FLORIDA WHO DOES ABOUT 150 PROCEDURES A YEAR, 50 ARE GASTRIC BYPASSES. HE USES THE 1100 FOR BYPASSES. HE ORIGINALLY USED THE HDI BUT MOVED TO THE 1100. THE SURGEON DOES NOT CUT THROUGH STAPLE LINES OR DOING THINGS OUT OF THE ORDINARY. HE HAS BEEN GETTING THE ¿REPLACE INSTRUMENT¿ ERRORS MID-WAY TO EARLIER IN THE PROCEDURE. THE TROUBLE SHOOTING INTRA-OP INCLUDES CLEANING THE DEVICE WHEN PROMPTED BY THE GENERATOR AND WHEN THE DEVICE IS PLACED BACK INTO THE PATIENT, THE SURGEON GETS THE ¿REPLACE INSTRUMENT¿ ERROR. THE TEAM WALKED THROUGH WHAT THESE SCREENS MEAN IN REFERENCE TO THE CONDITION OF THE DEVICE AND BLADE. ALSO WENT THROUGH HOW THE ACE+7 IS DIFFERENT FROM THE 1100. THE ACE+7 IS MORE ROBUST WHILE THE 1100 IS MORE PRECISE BUT SENSITIVE. IT WAS COMMUNICATED THAT THE SURGEON SHOULD NOT TOUCH THE UTERINE MANIPULATOR OR ANYTHING HARDER THAN TITANIUM WHEN USING THE 1100, OTHERWISE IT COULD CAUSE DAMAGE TO THE BLADE. THE 1ST 2 COMPLAINTS WERE ANALYZED, AND THE BLADES HAD DAMAGE INDICATING METAL WAS TOUCHED. THE OTHER 2 DEVICE ANALYSES ARE STILL IN PROCESS. THE NEXT STEPS ARE ANALYZING THE OTHER 2 DEVICES AND THE REPS COMMUNICATING ALL THE INFORMATION TO THE SURGEON. INVESTIGATION SUMMARY: THE PRODUCT WAS RETURNED TO ETHICON ENDO SURGERY FOR EVALUATION. VISUAL INSPECTION AND FUNCTIONAL TESTING WERE CONDUCTED ON THE RETURNED DEVICE. THE DEVICE WAS RETURNED WITH THE DISTAL TIP OF THE BLADE BROKEN OFF AND NOT RETURNED. THE REMAINING BLADE PORTION WAS SCRATCHED, AND WITH EVIDENCE OF CONTACT WITH METAL IN OR OUT OF THE OPERATIVE FIELD. THIS BLADE TIP PORTION MAY HAVE BROKEN OFF OF THE DEVICE DURING TRANSPORT TO OUR ANALYSIS SITE. DURING FUNCTIONAL TESTING ON GEN11, AN ALERT SCREEN WAS DISPLAYED. A PROBABLE CAUSE OF THE DEVICE STOP ACTIVATING AND DISPLAY AN ALERT SCREEN IS BLADE DAMAGE. THE DEVICE WAS DISASSEMBLED TO INSPECT THE INTERNAL COMPONENTS AND NO ANOMALIES WERE FOUND. PROBABLE CAUSES OF BLADE DAMAGE, INCLUDING BREAKAGE, ARE EXTERNAL CONTACT DURING PRE-OP OR GENERAL USE, BLADE CONTACT WITH OTHER DEVICES, STAPLES OR CLIPS DURING THE PROCEDURE. ONCE MINOR BLADE DAMAGE HAS OCCURRED, SUBSEQUENT ACTIVATIONS MAY INCREASE THE SEVERITY OF THE BLADE DAMAGE. THIS IN TURN CAN RESULT IN ACTIVATION ISSUES SUCH AS FAILING THE PRE-RUN TEST WITH THE GENERATOR AND DISPLAYING AN ALERT SCREEN. THESE ALERT SCREENS THAT CAN RESULT ARE SUCH AS ""REMOVE INSTRUMENT FROM PATIENT"" OR ¿BLADE ERROR DETECTED¿ OR ""RELAXED PRESSURE ON BLADE"" FOLLOWED BY A ¿REPLACE INSTRUMENT¿ SCREEN LATER IN THE PROCEDURE. CONTINUED USAGE OF THE DAMAGE BLADE CAN RESULT IN A BROKEN BLADE. AS PART OF ETHICON ENDO SURGERY QUALITY PROCESS ALL DEVICES ARE MANUFACTURED, INSPECTED, AND RELEASED TO APPROVED SPECIFICATIONS. A MANUFACTURING RECORD EVALUATION WAS PERFORMED FOR THE FINISHED DEVICE BATCH NUMBER, AND NO NON-CONFORMANCES WERE IDENTIFIED. ADDITIONAL COMPLAINT INFORMATION MONITORING FOR POTENTIAL SAFETY SIGNALS WILL BE CONDUCTED THROUGH COMPLAINT TRENDING AS PART OF POST MARKET SURVEILLANCE. IF INFORMATION IS OBTAINED THAT WAS NOT AVAILABLE FOR THE INITIAL REPORT, A FOLLOW-UP REPORT WILL BE FILED AS APPROPRIATE. IT WAS REPORTED THAT DURING AN UNKNOWN PROCEDURE, THE DEVICE WOULD NOT WORK AND SCREEN SAID TO CLEAN THE DEVICE AND RETEST. STAFF TRIED AGAIN AND THE SAME MESSAGE CAME UP. STAFF TRIED AGAIN AND THE DEVICE SAID TO REPLACE. THERE WERE NO PATIENT CONSEQUENCES REPORTED."
